id,City,State,District,Density,Latitude,Longitude,Rating,Number of Reviews,Specialisation,No of Beds,Insurance Schemes
Hospital #677,Bangalore,Karnataka,Bangalore Urban,4378.0,12.997437451015273,77.66688334504428,4.2,285,Pulmonology,18,"CGHS, NHM, NRHM, PMSSY, AIIMS"
Hospital #678,Bangalore,Karnataka,Bangalore Urban,4378.0,12.903138201193196,77.56794528063563,4.6,8018,Pediatrics,42,"NHA, OPD, CGHS, NUHM, MoHFW"
Hospital #679,Bangalore,Karnataka,Bangalore Urban,4378.0,12.963674179947247,77.53821432816517,4.5,2027,Pulmonology,14,"NHM, MoHFW, OPD, NUHM, AIIMS"
Hospital #680,Bangalore,Karnataka,Bangalore Urban,4378.0,12.777715189766884,77.64017133979617,4.3,1227,"Ophthalmology, Gynecology",16,"AB-PMJAY, NHA, NUHM, NRHM, OPD, CGHS"
Hospital #681,Bangalore,Karnataka,Bangalore Urban,4378.0,12.941465916131255,77.53915147239711,3.5,25,Ophthalmology,25,"NRHM, NHM, AB-PMJAY, OPD, AIIMS"
Hospital #682,Bangalore,Karnataka,Bangalore Urban,4378.0,12.975900193825218,77.53090095158656,4.1,664,"Pediatrics, Urology",28,"PMSSY, OPD, CGHS, MoHFW, AB-PMJAY, AIIMS"
Hospital #683,Bangalore,Karnataka,Bangalore Urban,4378.0,12.920440553982946,77.65964177076147,3.1,96,"Gynecology, Gastroenterology",21,"MoHFW, AB-PMJAY, AIIMS, NHA, NUHM"
Hospital #684,Bangalore,Karnataka,Bangalore Urban,4378.0,13.024353217922208,77.57098777997983,4.1,229,Urology,11,"AB-PMJAY, AIIMS, PMSSY, NUHM, CGHS, NHA"
Hospital #685,Bangalore,Karnataka,Bangalore Urban,4378.0,12.98236396225838,77.62236263181538,3.7,697,Gynecology,15,"OPD, NRHM, AIIMS, MoHFW, NHM, AB-PMJAY"
Hospital #686,Bangalore,Karnataka,Bangalore Urban,4378.0,12.93435516249776,77.57503643711597,4.7,10360,"Pulmonology, Orthopedics",31,"NHA, MoHFW, PMSSY, NUHM, OPD"
Hospital #687,Bangalore,Karnataka,Bangalore Urban,4378.0,12.889743218915644,77.60052611897048,4.7,19353,Gastroenterology,1,"AIIMS, NHM, OPD, NUHM, PMSSY"
Hospital #688,Bangalore,Karnataka,Bangalore Urban,4378.0,12.999995441471544,77.66582646199944,4.7,1894,"Pediatrics, General Surgery",23,"CGHS, NHA, AB-PMJAY, OPD, NRHM"
Hospital #689,Bangalore,Karnataka,Bangalore Urban,4378.0,12.967047828749449,77.23994206142572,2.1,230,Oncology,30,"NRHM, CGHS, AB-PMJAY, NUHM, MoHFW"
Hospital #690,Bangalore,Karnataka,Bangalore Urban,4378.0,12.972605069351168,77.65521367564268,4.3,881,Pulmonology,22,"NHM, OPD, CGHS, NRHM, NUHM"
Hospital #691,Bangalore,Karnataka,Bangalore Urban,4378.0,12.883926822112048,77.82422153641713,3.5,47,"General Surgery, Gastroenterology",21,"PMSSY, CGHS, NHA, NHM, NUHM, OPD"
Hospital #692,Bangalore,Karnataka,Bangalore Urban,4378.0,12.85544369341919,77.46414071594282,4.0,147,Gynecology,23,"NUHM, NRHM, NHM, AIIMS, MoHFW, NHA"
Hospital #693,Bangalore,Karnataka,Bangalore Urban,4378.0,12.953628434150405,77.59647759611677,3.9,198,Ophthalmology,35,"MoHFW, NHA, AIIMS, OPD, PMSSY, NUHM"
Hospital #694,Bangalore,Karnataka,Bangalore Urban,4378.0,12.961860987698142,77.59589224388979,4.4,129,Orthopedics,11,"CGHS, AIIMS, AB-PMJAY, OPD, NHM"
Hospital #695,Bangalore,Karnataka,Bangalore Urban,4378.0,12.975224728980134,77.50174134561743,3.9,644,"Dermatology, Ophthalmology",1,"OPD, NHM, NRHM, CGHS, PMSSY, AIIMS"
Hospital #696,Bangalore,Karnataka,Bangalore Urban,4378.0,12.920186818961458,77.61469759843405,4.4,2044,Cardiology,27,"NRHM, AB-PMJAY, PMSSY, CGHS, NHA, NHM"
Hospital #697,Bangalore,Karnataka,Bangalore Urban,4378.0,12.790313224436533,77.63896898077061,3.3,297,Gynecology,14,"AB-PMJAY, NRHM, NUHM, MoHFW, CGHS, PMSSY"
Hospital #698,Bangalore,Karnataka,Bangalore Urban,4378.0,12.884621102833076,77.6644990360843,3.2,690,Pediatrics,3,"OPD, NRHM, CGHS, NUHM, PMSSY"
Hospital #699,Bangalore,Karnataka,Bangalore Urban,4378.0,12.877186717253927,77.65580611402108,4.6,759,"Pulmonology, Oncology",31,"NHM, AB-PMJAY, NRHM, PMSSY, CGHS, MoHFW"
Hospital #700,Bangalore,Karnataka,Bangalore Urban,4378.0,12.900428179299569,77.62984058637569,4.5,570,Gynecology,22,"AIIMS, MoHFW, PMSSY, CGHS, NHA, AB-PMJAY"
Hospital #701,Bangalore,Karnataka,Bangalore Urban,4378.0,12.758706370965854,77.45562903451611,3.0,85,Pediatrics,24,"CGHS, AIIMS, OPD, AB-PMJAY, NRHM"
Hospital #702,Bangalore,Karnataka,Bangalore Urban,4378.0,13.235218332599144,77.41380074326744,3.5,8,"Nephrology, Cardiology",18,"MoHFW, NHA, NRHM, NHM, PMSSY, NUHM"
Hospital #703,Bangalore,Karnataka,Bangalore Urban,4378.0,12.920751480128551,77.56989427380074,4.2,951,Cardiology,32,"PMSSY, AIIMS, OPD, CGHS, NUHM, MoHFW"
Hospital #704,Bangalore,Karnataka,Bangalore Urban,4378.0,13.04478759753653,77.47741173652571,4.6,2239,"Gynecology, Dermatology",23,"NHM, CGHS, NRHM, MoHFW, NUHM, NHA"
Hospital #705,Bangalore,Karnataka,Bangalore Urban,4378.0,13.036191223768022,77.64216581547967,4.4,6565,Psychiatry,12,"PMSSY, OPD, NHM, NHA, AB-PMJAY"
Hospital #706,Bangalore,Karnataka,Bangalore Urban,4378.0,12.92542064542626,77.45577774534075,3.1,126,Endocrinology,21,"PMSSY, NHM, AB-PMJAY, OPD, NUHM"
Hospital #707,Bangalore,Karnataka,Bangalore Urban,4378.0,12.900667920129584,77.56979399913598,3.5,585,"Neurology, Cardiology",12,"NHM, NHA, OPD, AIIMS, CGHS, MoHFW"
Hospital #708,Bangalore,Karnataka,Bangalore Urban,4378.0,13.198855872233576,77.72058426351543,3.8,210,Gastroenterology,13,"AIIMS, OPD, NRHM, PMSSY, CGHS, MoHFW"
Hospital #709,Bangalore,Karnataka,Bangalore Urban,4378.0,13.001005732013638,77.60764767412508,4.1,229,"Urology, Nephrology",2,"MoHFW, CGHS, NRHM, AIIMS, NHM"
Hospital #710,Bangalore,Karnataka,Bangalore Urban,4378.0,13.154559991346751,77.41378315385805,4.2,33,Neurology,27,"NHA, NRHM, OPD, AB-PMJAY, PMSSY, CGHS"
Hospital #711,Bangalore,Karnataka,Bangalore Urban,4378.0,12.91881159430849,77.77565935839918,3.9,85,"Cardiology, Psychiatry",1,"MoHFW, NRHM, AB-PMJAY, NHM, NHA"
Hospital #712,Bangalore,Karnataka,Bangalore Urban,4378.0,12.881854523215411,77.77207818683017,3.2,67,"Psychiatry, Gastroenterology",21,"NRHM, NUHM, AIIMS, AB-PMJAY, PMSSY"
Hospital #713,Bangalore,Karnataka,Bangalore Urban,4378.0,12.895493567737756,77.56243173814318,4.8,8332,"Neurology, Psychiatry",23,"NRHM, AB-PMJAY, AIIMS, NUHM, CGHS, NHM"
Hospital #714,Bangalore,Karnataka,Bangalore Urban,4378.0,13.11100438177747,77.58833708487532,3.7,258,Endocrinology,15,"NUHM, PMSSY, AIIMS, MoHFW, NHM, NRHM"
Hospital #715,Bangalore,Karnataka,Bangalore Urban,4378.0,12.93500566744184,77.43563474817077,4.1,726,"Ophthalmology, Pulmonology",9,"NUHM, NHA, AIIMS, NHM, AB-PMJAY, PMSSY"
Hospital #716,Bangalore,Karnataka,Bangalore Urban,4378.0,12.986219501625644,77.59861385970997,4.6,5144,"Oncology, Endocrinology",24,"MoHFW, NUHM, PMSSY, CGHS, NRHM"
Hospital #717,Bangalore,Karnataka,Bangalore Urban,4378.0,13.051090307517663,77.60153039291568,3.6,412,"Neurology, Nephrology",37,"NHM, AB-PMJAY, OPD, NUHM, MoHFW, PMSSY"
Hospital #718,Bangalore,Karnataka,Bangalore Urban,4378.0,12.941987867271216,77.53242409130989,4.7,705,Endocrinology,1,"NUHM, MoHFW, NRHM, PMSSY, OPD"
Hospital #719,Bangalore,Karnataka,Bangalore Urban,4378.0,12.904250096191422,77.52252700154986,4.0,495,Neurology,1,"PMSSY, NHM, NHA, NRHM, NUHM"
Hospital #720,Bangalore,Karnataka,Bangalore Urban,4378.0,12.923373918670263,77.57233800891568,4.0,766,Ophthalmology,17,"MoHFW, NHA, AB-PMJAY, NUHM, OPD"
Hospital #721,Bangalore,Karnataka,Bangalore Urban,4378.0,12.904383919841855,77.54194691668599,4.0,161,Gastroenterology,23,"PMSSY, CGHS, OPD, MoHFW, NRHM, NUHM"
Hospital #722,Bangalore,Karnataka,Bangalore Urban,4378.0,12.975663978723135,77.64127365033967,3.6,1150,Neurology,26,"AB-PMJAY, MoHFW, NUHM, AIIMS, NHA, OPD"
Hospital #723,Bangalore,Karnataka,Bangalore Urban,4378.0,12.968144904279873,77.57236018446247,4.1,315,"Pediatrics, Oncology",24,"NHM, NRHM, MoHFW, CGHS, NUHM"
Hospital #724,Bangalore,Karnataka,Bangalore Urban,4378.0,12.94829490759458,77.70129519735754,3.5,642,"Orthopedics, Dermatology",22,"NHA, NRHM, OPD, PMSSY, NUHM, AB-PMJAY"
Hospital #725,Bangalore,Karnataka,Bangalore Urban,4378.0,12.998025485617472,77.57741813642723,3.3,257,"Gastroenterology, Pulmonology",18,"NHM, AIIMS, PMSSY, MoHFW, CGHS"
Hospital #726,Bangalore,Karnataka,Bangalore Urban,4378.0,13.047179668627653,77.50515930059213,4.6,1263,Pulmonology,18,"NRHM, CGHS, NHA, AIIMS, NUHM"
Hospital #727,Bangalore,Karnataka,Bangalore Urban,4378.0,13.148112675681611,77.66358509864897,4.9,112,Urology,24,"MoHFW, PMSSY, OPD, AB-PMJAY, NUHM"
Hospital #728,Bangalore,Karnataka,Bangalore Urban,4378.0,12.950477177996902,77.596309979732,4.6,4792,"Psychiatry, Gynecology",1,"OPD, AB-PMJAY, NUHM, AIIMS, MoHFW, CGHS"
Hospital #729,Bangalore,Karnataka,Bangalore Urban,4378.0,12.9295593437005,77.5798308316968,4.8,13479,"Pediatrics, General Surgery",33,"OPD, AIIMS, CGHS, NRHM, NUHM, MoHFW"
Hospital #730,Bangalore,Karnataka,Bangalore Urban,4378.0,13.009618620702684,77.7490141894578,3.7,945,Neurology,5,"NUHM, AB-PMJAY, NHA, AIIMS, NHM, MoHFW"
Hospital #731,Bangalore,Karnataka,Bangalore Urban,4378.0,13.11703099583298,77.55524170101673,4.3,177,"Pediatrics, Nephrology",34,"AB-PMJAY, CGHS, NHA, NHM, MoHFW"
Hospital #732,Bangalore,Karnataka,Bangalore Urban,4378.0,13.070366497109596,77.63499534436495,4.9,112,Ophthalmology,22,"NUHM, MoHFW, NRHM, CGHS, NHM"
Hospital #733,Bangalore,Karnataka,Bangalore Urban,4378.0,12.989062154817052,77.61144745209475,3.5,361,"Gastroenterology, Neurology",5,"NHM, NRHM, PMSSY, NHA, NUHM"
Hospital #734,Bangalore,Karnataka,Bangalore Urban,4378.0,12.790553834788348,77.74478548626313,4.0,935,"General Surgery, Gynecology",30,"CGHS, NUHM, MoHFW, AB-PMJAY, OPD, PMSSY"
Hospital #735,Bangalore,Karnataka,Bangalore Urban,4378.0,12.879732951019244,77.80008514507756,3.1,1,"Cardiology, Orthopedics",19,"NUHM, PMSSY, NHA, AIIMS, NHM"
Hospital #736,Bangalore,Karnataka,Bangalore Urban,4378.0,13.062479287325022,77.49269692638154,4.4,3513,"Neurology, Nephrology",14,"CGHS, NHA, NUHM, AB-PMJAY, MoHFW, AIIMS"
Hospital #737,Bangalore,Karnataka,Bangalore Urban,4378.0,13.039523668381555,77.59489178537974,4.6,237,Pediatrics,14,"CGHS, MoHFW, PMSSY, AIIMS, OPD, AB-PMJAY"
Hospital #738,Bangalore,Karnataka,Bangalore Urban,4378.0,12.951044699104102,77.49789256539788,4.6,2545,"Cardiology, Endocrinology",22,"MoHFW, NHM, NHA, PMSSY, NRHM"
Hospital #739,Bangalore,Karnataka,Bangalore Urban,4378.0,12.875720696183368,77.55361755044058,4.1,163,"Cardiology, Nephrology",20,"PMSSY, OPD, NHM, AB-PMJAY, NUHM"
Hospital #740,Bangalore,Karnataka,Bangalore Urban,4378.0,12.901991208845176,77.64332480749766,4.2,152,Nephrology,13,"NHM, CGHS, OPD, PMSSY, NUHM"
Hospital #741,Bangalore,Karnataka,Bangalore Urban,4378.0,12.930100576496834,77.5712739644582,3.6,96,Psychiatry,4,"PMSSY, AIIMS, AB-PMJAY, NHA, NRHM"
Hospital #742,Bantwal,Karnataka,Dakshina Kannada,457.0,12.8824375,75.0293679,3.2,69,"Oncology, Urology",11,"MoHFW, AIIMS, PMSSY, NHM, CGHS, NUHM"
Hospital #743,Belgaum,Karnataka,Belagavi,356.0,15.807735607473784,74.4835070168695,3.2,71,"Nephrology, Gastroenterology",25,"AB-PMJAY, NRHM, OPD, MoHFW, PMSSY"
Hospital #744,Belgaum,Karnataka,Belagavi,356.0,15.83004341479483,74.45806784156946,4.9,86,"Endocrinology, General Surgery",1,"NRHM, NUHM, CGHS, MoHFW, NHM, AB-PMJAY"
Hospital #745,Belgaum,Karnataka,Belagavi,356.0,15.89990076055294,74.52043658829152,3.7,1056,Cardiology,13,"AIIMS, MoHFW, AB-PMJAY, NHM, CGHS, NHA"
Hospital #746,Belgaum,Karnataka,Belagavi,356.0,15.881096481925113,74.50990080427631,3.3,36,Dermatology,24,"NHM, NRHM, MoHFW, AB-PMJAY, NUHM, OPD"
Hospital #747,Belguam,Karnataka,Belagavi,356.0,15.964695927151348,74.66785224993042,2.4,7,General Surgery,4,"CGHS, MoHFW, NHA, NRHM, OPD, NUHM"
Hospital #748,Belguam,Karnataka,Belagavi,356.0,15.838880369756364,74.44394026267648,3.4,65,"Gynecology, Cardiology",13,"NHA, NRHM, NHM, AB-PMJAY, PMSSY, OPD"
Hospital #749,Belguam,Karnataka,Belagavi,356.0,15.891205553221472,74.53343902417686,3.3,75,"Ophthalmology, Dermatology",20,"CGHS, OPD, NRHM, AIIMS, PMSSY, NHA"
Hospital #750,Belguam,Karnataka,Belagavi,356.0,15.817625473238792,74.46590410051631,4.2,414,Neurology,25,"AIIMS, AB-PMJAY, OPD, NHM, PMSSY"
Hospital #751,Belguam,Karnataka,Belagavi,356.0,15.859749763611456,74.47147293850554,4.7,159,Orthopedics,25,"MoHFW, PMSSY, NHA, AIIMS, CGHS"
Hospital #752,Bellary,Karnataka,Ballari,330.0,15.1963125,76.6563679,3.7,232,Ophthalmology,28,"CGHS, PMSSY, NHA, AB-PMJAY, NUHM"
Hospital #753,Bellary,Karnataka,Ballari,330.0,15.165595699377093,76.90985433199886,2.9,6,Psychiatry,22,"CGHS, PMSSY, NHM, NHA, OPD"
Hospital #754,Bellary,Karnataka,Ballari,330.0,15.157700796786235,76.92753919306739,4.3,218,"Pulmonology, Urology",6,"NRHM, CGHS, AIIMS, PMSSY, MoHFW"
Hospital #755,Bidar,Karnataka,Bidar,312.0,18.02614448941741,77.53332959828977,3.1,46,"Pulmonology, Cardiology",9,"NHA, AIIMS, OPD, PMSSY, AB-PMJAY, MoHFW"
Hospital #756,Bidar,Karnataka,Bidar,312.0,17.888160094021423,77.47798735655226,3.8,189,"Oncology, Gynecology",29,"NHM, CGHS, OPD, NUHM, MoHFW"
Hospital #757,Bidar,Karnataka,Bidar,312.0,17.895762934257082,77.47536947326455,3.8,129,"Psychiatry, Dermatology",29,"OPD, NUHM, AIIMS, AB-PMJAY, PMSSY, MoHFW"
Hospital #758,Bijapur,Karnataka,Bijapur,207.0,16.819660319566342,75.69712815970877,3.9,110,Cardiology,12,"NHA, NRHM, NHM, MoHFW, AIIMS, AB-PMJAY"
Hospital #758,Bijapur,Karnataka,Bijapur,35.0,16.819660319566342,75.69712815970877,3.9,110,"Psychiatry, Cardiology",21,"NUHM, NHM, MoHFW, AIIMS, NRHM"
Hospital #759,Bijapur,Karnataka,Bijapur,207.0,16.816205281349582,75.72203292774856,3.9,193,"Endocrinology, Ophthalmology",16,"CGHS, NUHM, AB-PMJAY, NHM, OPD, NRHM"
Hospital #759,Bijapur,Karnataka,Bijapur,35.0,16.816205281349582,75.72203292774856,3.9,193,Psychiatry,19,"NUHM, AIIMS, NHM, MoHFW, NRHM"
Hospital #760,Bijapur,Karnataka,Bijapur,207.0,16.83864478177399,75.60299989795568,3.5,35,"Dermatology, General Surgery",1,"NHA, OPD, AB-PMJAY, PMSSY, NUHM"
Hospital #760,Bijapur,Karnataka,Bijapur,35.0,16.83864478177399,75.60299989795568,3.5,35,Psychiatry,17,"NHA, PMSSY, NUHM, OPD, NHM, MoHFW"
Hospital #761,Bijapur,Karnataka,Bijapur,207.0,12.80754281466761,77.37452482313164,3.4,36,"Gastroenterology, Orthopedics",21,"NHM, AB-PMJAY, NHA, NRHM, OPD, MoHFW"
Hospital #761,Bijapur,Karnataka,Bijapur,35.0,12.80754281466761,77.37452482313164,3.4,36,Orthopedics,22,"PMSSY, AIIMS, CGHS, MoHFW, AB-PMJAY, NUHM"
Hospital #762,Binaga,Karnataka,Uttara Kannada,132.0,12.952795950731904,77.58217820049379,3.6,300,"Oncology, Orthopedics",25,"AB-PMJAY, NHA, NUHM, NHM, CGHS"
Hospital #763,Chamrajnagar,Karnataka,Chamarajanagar,200.0,13.308232046903097,75.72224842119125,3.2,82,"Gynecology, Oncology",19,"AIIMS, MoHFW, NRHM, PMSSY, NUHM"
Hospital #764,Chickmangalore,Karnataka,Chikmagalur,158.0,13.322904315779049,75.76248674705275,4.8,298,Urology,11,"OPD, CGHS, PMSSY, NHA, NUHM, AB-PMJAY"
Hospital #765,Chickmangalore,Karnataka,Chikmagalur,158.0,13.5569375,76.0099929,3.8,10,"Cardiology, Pediatrics",39,"AB-PMJAY, OPD, NHM, NUHM, CGHS, NHA"
Hospital #766,Chikmagalaur,Karnataka,Chikmagalur,158.0,13.35583379963619,75.78446281626849,3.5,113,"General Surgery, Pulmonology",24,"CGHS, AB-PMJAY, OPD, PMSSY, AIIMS, NUHM"
Hospital #767,Chikmagalaur,Karnataka,Chikmagalur,158.0,13.372062405607585,75.78025426263785,4.2,159,"Pulmonology, Orthopedics",6,"NHA, AIIMS, PMSSY, MoHFW, OPD, NRHM"
Hospital #768,Chikmaglur,Karnataka,Chikmagalur,158.0,13.3373591408599,75.77503150615682,4.5,2044,"Gynecology, Ophthalmology",16,"CGHS, NHM, NRHM, MoHFW, PMSSY, AIIMS"
Hospital #769,Chitradurga,Karnataka,Chitradurga,197.0,14.212330554835807,76.38672402964353,3.8,3,Nephrology,16,"CGHS, PMSSY, AIIMS, MoHFW, NHM, NHA"
Hospital #770,Chitradurga,Karnataka,Chitradurga,197.0,14.229574625972315,76.39483036187912,4.4,77,Orthopedics,24,"NHA, NRHM, NHM, MoHFW, AIIMS"
Hospital #771,Chitradurga,Karnataka,Chitradurga,197.0,14.470031145980553,75.91042526104344,4.5,11,"Ophthalmology, Gastroenterology",26,"OPD, PMSSY, NUHM, AIIMS, NRHM, AB-PMJAY"
Hospital #772,Davangere,Karnataka,Davanagere,370.0,14.470570030807623,75.9097332913068,3.1,280,Endocrinology,10,"NHA, AB-PMJAY, AIIMS, NRHM, NHM"
Hospital #773,Davangere,Karnataka,Davanagere,370.0,14.457043607824271,75.91450496940834,4.8,2338,Gynecology,13,"NUHM, OPD, PMSSY, CGHS, MoHFW"
Hospital #774,Davangere,Karnataka,Davanagere,370.0,14.442734769079536,75.92043887089106,4.4,67,Urology,26,"AB-PMJAY, MoHFW, CGHS, NHM, NUHM"
Hospital #775,Davangere,Karnataka,Davanagere,370.0,15.426953574623486,74.901842749446,3.5,24,Gastroenterology,20,"CGHS, NUHM, NRHM, AIIMS, AB-PMJAY"
Hospital #776,Dharwad,Karnataka,Dharwad,434.0,15.450476184839076,75.04064130034695,3.4,158,"Neurology, Pediatrics",26,"NUHM, CGHS, AIIMS, AB-PMJAY, MoHFW, NHA"
Hospital #777,Dharwad,Karnataka,Dharwad,434.0,15.311929997220428,74.94823925611263,3.1,9,"Urology, Pediatrics",19,"CGHS, NUHM, AIIMS, NHA, NRHM, OPD"
Hospital #778,Dharwad,Karnataka,Dharwad,434.0,15.417304991666274,75.03993740466142,4.1,3019,Neurology,41,"NHA, AIIMS, OPD, NUHM, CGHS"
Hospital #779,Dharwad,Karnataka,Dharwad,434.0,15.500472836290498,75.05123694659294,3.5,68,"Dermatology, Gynecology",19,"NHM, NHA, AIIMS, CGHS, NUHM, OPD"
Hospital #780,Gokak,Karnataka,Belagavi,356.0,16.1649375,74.8423679,4.1,38,Pulmonology,6,"NHM, CGHS, MoHFW, AIIMS, NUHM, NRHM"
Hospital #781,Gulbarga,Karnataka,Kalaburagi,233.0,17.313327861185165,76.73168222375446,3.6,4,"Psychiatry, Pediatrics",15,"NHA, NHM, OPD, AB-PMJAY, NRHM"
Hospital #782,Gulbarga,Karnataka,Kalaburagi,233.0,17.33189930494152,76.720015466826,3.3,70,"Ophthalmology, Gastroenterology",31,"NUHM, AIIMS, MoHFW, NHM, CGHS, AB-PMJAY"
Hospital #783,Gulbarga,Karnataka,Kalaburagi,233.0,17.360200466749568,76.87300777065141,3.1,68,Cardiology,17,"NHM, NRHM, MoHFW, PMSSY, OPD"
Hospital #784,Gulbarga,Karnataka,Kalaburagi,233.0,17.296018711376064,76.87183445935476,4.4,21,"Dermatology, Gynecology",22,"MoHFW, NHA, NUHM, AIIMS, AB-PMJAY"
Hospital #785,Hassan,Karnataka,Hassan,261.0,12.998843502758614,76.11251709288238,3.2,83,Cardiology,11,"NHM, AIIMS, OPD, PMSSY, MoHFW, NUHM"
Hospital #786,Hassan,Karnataka,Hassan,261.0,12.99803987845578,76.11407986240005,4.0,523,"Ophthalmology, Pediatrics",9,"NRHM, AB-PMJAY, AIIMS, NUHM, PMSSY"
Hospital #787,Hassan,Karnataka,Hassan,261.0,12.329620125653877,76.61015017706552,4.1,314,"Neurology, General Surgery",39,"PMSSY, AB-PMJAY, AIIMS, OPD, NHM, NRHM"
Hospital #788,Hassan,Karnataka,Hassan,261.0,12.339591970983143,76.62749884166985,4.1,229,Pediatrics,9,"CGHS, NRHM, NUHM, AIIMS, PMSSY"
Hospital #789,Hassan,Karnataka,Hassan,261.0,12.27655176680632,76.62383072707738,4.1,229,"Gastroenterology, Neurology",25,"NUHM, CGHS, MoHFW, NHM, OPD"
Hospital #790,Hassan,Karnataka,Hassan,261.0,12.327784888690523,76.60479606021205,4.1,229,Gastroenterology,22,"OPD, MoHFW, CGHS, NHA, NUHM"
Hospital #791,Hassan,Karnataka,Hassan,261.0,12.337353919582291,76.64981419267659,4.1,229,"Oncology, Nephrology",25,"AIIMS, MoHFW, NRHM, PMSSY, NUHM"
Hospital #792,Hassan,Karnataka,Hassan,261.0,12.36847980511483,76.5993733535464,4.1,229,"Gastroenterology, Pulmonology",25,"PMSSY, NHM, NHA, AB-PMJAY, OPD"
Hospital #793,Hospet,Karnataka,Vijayanagara,240.0,12.294569666287227,76.60547620307467,4.1,229,"Ophthalmology, Neurology",16,"AB-PMJAY, MoHFW, OPD, NRHM, NHA"
Hospital #794,Hospet,Karnataka,Vijayanagara,240.0,12.346314293316702,76.61147310639795,4.1,229,"Neurology, Nephrology",18,"MoHFW, AIIMS, CGHS, NRHM, NUHM, NHA"
Hospital #795,Hubli,Karnataka,Dharwad,434.0,12.392366135310809,76.56103565234697,4.0,262,"Orthopedics, Urology",27,"NHA, AIIMS, AB-PMJAY, NHM, NUHM"
Hospital #796,Hubli,Karnataka,Dharwad,434.0,12.28222014838432,76.54719353228938,4.1,229,"Ophthalmology, Endocrinology",30,"PMSSY, NHM, MoHFW, CGHS, NUHM, AB-PMJAY"
Hospital #797,Hubli,Karnataka,Dharwad,434.0,12.329088931439756,76.61747536555184,4.2,201,Gynecology,10,"AB-PMJAY, PMSSY, NUHM, CGHS, NHM"
Hospital #798,Hubli,Karnataka,Dharwad,434.0,12.342462981893426,76.59794936360005,4.1,229,"Pediatrics, Neurology",4,"PMSSY, MoHFW, NHM, NHA, NUHM, AB-PMJAY"
Hospital #799,Hubli,Karnataka,Dharwad,434.0,12.33910657640019,76.60249329585771,4.0,262,"Nephrology, Psychiatry",17,"CGHS, AB-PMJAY, PMSSY, NUHM, NRHM, AIIMS"
Hospital #800,Hubli,Karnataka,Dharwad,434.0,12.334256164644906,76.60496294977484,4.2,201,Neurology,1,"OPD, AIIMS, NUHM, CGHS, MoHFW"
Hospital #801,Hubli,Karnataka,Dharwad,434.0,12.357020142428087,76.6433949468675,4.2,201,Cardiology,25,"NHA, AB-PMJAY, OPD, PMSSY, AIIMS"
Hospital #802,Hubli,Karnataka,Dharwad,434.0,12.34586687822221,76.66107991484293,4.1,229,"Urology, General Surgery",12,"NRHM, CGHS, NHM, AIIMS, MoHFW"
Hospital #803,Hubli,Karnataka,Dharwad,434.0,12.396324831539314,76.56783956545144,4.1,229,"Neurology, Orthopedics",10,"NRHM, NHM, PMSSY, MoHFW, NHA, OPD"
Hospital #804,Hubli,Karnataka,Dharwad,434.0,12.313399346632677,76.60598227910106,4.1,229,Ophthalmology,3,"AIIMS, PMSSY, NRHM, NHA, NUHM, MoHFW"
Hospital #805,Hubli,Karnataka,Dharwad,434.0,12.27622616125374,76.60353123588219,4.1,229,Oncology,26,"AIIMS, MoHFW, OPD, PMSSY, CGHS"
Hospital #806,Hubli,Karnataka,Dharwad,434.0,12.270737202778797,76.61030618592527,4.2,201,"Nephrology, Gastroenterology",20,"NUHM, CGHS, PMSSY, NHA, MoHFW, NHM"
Hospital #807,Hubli,Karnataka,Dharwad,434.0,12.321851990357263,76.59207500546171,4.1,229,"Nephrology, Ophthalmology",9,"OPD, AB-PMJAY, NHA, CGHS, PMSSY"
Hospital #808,Hubli,Karnataka,Dharwad,434.0,12.306395600408273,76.63091588582418,4.0,262,Endocrinology,23,"NRHM, AIIMS, CGHS, MoHFW, NHM"
Hospital #809,Karwar,Karnataka,Uttara Kannada,132.0,12.329296709654187,76.61407092699001,4.2,201,Cardiology,16,"NRHM, PMSSY, CGHS, NHM, AB-PMJAY, MoHFW"
Hospital #810,Kolar,Karnataka,Kolar,384.0,12.390552893207865,76.64811645705005,4.1,229,"Psychiatry, Ophthalmology",10,"NHA, OPD, NHM, CGHS, NRHM"
Hospital #811,Kolar,Karnataka,Kolar,384.0,12.287473247828707,76.58741800204467,4.0,262,"Oncology, Psychiatry",32,"PMSSY, NHA, NRHM, MoHFW, NUHM, AIIMS"
Hospital #812,Kolar,Karnataka,Kolar,384.0,12.365658635056729,76.56989423603129,4.1,229,Urology,21,"CGHS, MoHFW, NHM, NHA, NUHM, NRHM"
Hospital #813,Kolar,Karnataka,Kolar,384.0,12.336047829812737,76.61047984870541,4.1,229,"Gynecology, Orthopedics",16,"MoHFW, AIIMS, AB-PMJAY, NRHM, PMSSY, NHA"
Hospital #814,Koppal,Karnataka,Koppal,250.0,12.347291694773844,76.59377173745965,4.1,229,Endocrinology,10,"NUHM, PMSSY, AB-PMJAY, NHA, CGHS"
Hospital #815,Kundapur,Karnataka,Udupi,304.0,12.409523311502962,76.47327992875624,3.7,74,"Nephrology, Gastroenterology",23,"AIIMS, NUHM, CGHS, NRHM, AB-PMJAY"
Hospital #816,Madikeri,Karnataka,Kodagu,135.0,12.311173484872398,76.67877551722196,3.8,66,General Surgery,11,"AIIMS, NUHM, NHM, NRHM, OPD"
Hospital #817,Mandya,Karnataka,Mandya,365.0,12.280116086164,76.6798500338608,3.8,66,"Urology, Oncology",25,"CGHS, OPD, NUHM, NRHM, MoHFW"
Hospital #818,Mandya,Karnataka,Mandya,365.0,12.333152718198283,76.61370980105409,3.8,66,"Gastroenterology, Endocrinology",22,"PMSSY, NUHM, NHA, CGHS, AIIMS, OPD"
Hospital #819,Mandya,Karnataka,Mandya,365.0,12.30630578089488,76.64213280796423,3.8,66,"Endocrinology, Orthopedics",27,"CGHS, NUHM, PMSSY, OPD, AIIMS"
Hospital #820,Mandya,Karnataka,Mandya,365.0,12.46474048990784,76.60581701986257,3.8,66,"Orthopedics, Gynecology",34,"NUHM, NRHM, AIIMS, CGHS, AB-PMJAY, NHA"
Hospital #821,Mandya,Karnataka,Mandya,365.0,12.31441558512688,76.61381179462224,3.9,59,"Gynecology, Nephrology",18,"AB-PMJAY, NHA, MoHFW, CGHS, NUHM, NRHM"
Hospital #822,Mangalore,Karnataka,Dakshina Kannada,457.0,12.330578560367226,76.61216364563933,3.8,66,Pediatrics,34,"AB-PMJAY, NHA, NHM, NUHM, OPD"
Hospital #823,Mangalore,Karnataka,Dakshina Kannada,457.0,12.362683531083512,76.56401877144046,3.8,66,Endocrinology,17,"AB-PMJAY, NUHM, NRHM, NHA, OPD"
Hospital #824,Mangalore,Karnataka,Dakshina Kannada,457.0,12.451215673705018,76.56096179243514,3.8,66,"Cardiology, Neurology",32,"CGHS, OPD, AIIMS, PMSSY, MoHFW"
Hospital #825,Mangalore,Karnataka,Dakshina Kannada,457.0,12.382178601565808,76.68688675795494,3.8,66,"Psychiatry, Gastroenterology",12,"PMSSY, OPD, NRHM, AB-PMJAY, NHA, MoHFW"
Hospital #826,Mangalore,Karnataka,Dakshina Kannada,457.0,12.351332734075957,76.60555246095363,3.8,66,Cardiology,24,"NRHM, AB-PMJAY, AIIMS, NHM, OPD, CGHS"
Hospital #827,Mangalore,Karnataka,Dakshina Kannada,457.0,12.396833137239184,76.5969529347587,3.8,66,Pulmonology,28,"NHA, NHM, PMSSY, NUHM, AB-PMJAY"
Hospital #828,Mangalore,Karnataka,Dakshina Kannada,457.0,12.409821726836835,76.61441112713219,3.9,59,General Surgery,13,"NRHM, CGHS, NUHM, MoHFW, NHA, PMSSY"
Hospital #829,Mangalore,Karnataka,Dakshina Kannada,457.0,12.297367422346024,76.55522320638262,3.8,66,Gynecology,15,"NHA, OPD, AIIMS, NUHM, AB-PMJAY, NHM"
Hospital #830,Mangalore,Karnataka,Dakshina Kannada,457.0,12.44406664333956,76.64070180683859,3.8,66,Neurology,15,"AB-PMJAY, OPD, NRHM, NHA, PMSSY, NUHM"
Hospital #831,Mangalore,Karnataka,Dakshina Kannada,457.0,12.363418024684036,76.7437946204157,3.7,74,"Nephrology, Neurology",18,"NHA, NHM, PMSSY, AB-PMJAY, NUHM, AIIMS"
Hospital #832,Mangalore,Karnataka,Dakshina Kannada,457.0,12.436867700418617,76.66028595517005,3.8,66,Pediatrics,5,"MoHFW, OPD, AIIMS, NHM, NHA"
Hospital #833,Mysore,Karnataka,Mysore,437.0,12.302788506415222,76.62748010619595,4.1,229,"Gastroenterology, Dermatology",20,"PMSSY, AIIMS, NUHM, NRHM, AB-PMJAY, OPD"
Hospital #834,Mysore,Karnataka,Mysore,437.0,12.261996154424796,76.71227358756306,5.0,13,"Ophthalmology, Dermatology",20,"NHA, PMSSY, AIIMS, CGHS, NRHM, NUHM"
Hospital #835,Mysore,Karnataka,Mysore,437.0,12.331028514907494,76.61825090211936,3.6,57,Urology,44,"OPD, PMSSY, NHM, AB-PMJAY, AIIMS"
Hospital #836,Mysore,Karnataka,Mysore,437.0,12.292436203056536,76.60813234331044,4.9,35058,"Pediatrics, Cardiology",21,"PMSSY, NRHM, AIIMS, AB-PMJAY, NHM, NUHM"
Hospital #837,Mysore,Karnataka,Mysore,437.0,12.287245773353687,76.64229510679789,4.1,1123,"General Surgery, Urology",27,"NHA, MoHFW, NHM, NUHM, OPD, NRHM"
Hospital #838,Mysore,Karnataka,Mysore,437.0,12.358326707444604,76.60377606033859,4.8,1464,"Ophthalmology, Gastroenterology",12,"AIIMS, OPD, NRHM, AB-PMJAY, PMSSY"
Hospital #839,Mysore,Karnataka,Mysore,437.0,12.341412414104468,76.66153396706306,4.7,6991,"Urology, Pediatrics",8,"NUHM, MoHFW, AB-PMJAY, NRHM, CGHS, OPD"
