id,City,State,District,Density,Latitude,Longitude,Rating,Number of Reviews,Specialisation,No of Beds,Insurance Schemes
Hospital #0,Anantpur,Andhra Pradesh,Ananthapuramu,219.608,14.696532573816466,77.5845696812239,4.1,229,Pediatrics,19,"CGHS, AB-PMJAY, AIIMS, NHA, NUHM"
Hospital #1,Anantpur,Andhra Pradesh,Ananthapuramu,219.608,14.660634599686995,77.57934210631872,4.9,19172,Psychiatry,12,"AB-PMJAY, MoHFW, NHM, AIIMS, NUHM, NRHM"
Hospital #2,Chitoor,Andhra Pradesh,Chittoor,273.23,13.229217171761988,79.08447238508815,3.9,139,"Ophthalmology, Orthopedics",25,"OPD, PMSSY, NRHM, NHM, AB-PMJAY, NUHM"
Hospital #3,Chittoor,Andhra Pradesh,Chittoor,273.23,13.303435180892292,78.97211670732672,4.0,92,"Ophthalmology, Nephrology",11,"PMSSY, NHA, OPD, AIIMS, MoHFW, NUHM"
Hospital #4,East Godavari,Andhra Pradesh,East Godavari,715.46,16.970994716195186,82.2303962455134,4.8,8090,"Orthopedics, Pulmonology",34,"MoHFW, NHA, AB-PMJAY, OPD, NUHM"
Hospital #5,East Godavari,Andhra Pradesh,East Godavari,715.46,16.33095886027219,80.4615551422084,4.4,467,Neurology,5,"PMSSY, OPD, NUHM, NHM, AB-PMJAY"
Hospital #6,Guntur,Andhra Pradesh,Guntur,855.9,16.304665371173602,80.42615157785502,4.8,1121,"Urology, Dermatology",31,"CGHS, AB-PMJAY, MoHFW, AIIMS, NRHM"
Hospital #7,Guntur,Andhra Pradesh,Guntur,855.9,16.299439227373856,80.02127093796369,4.5,479,"Urology, Endocrinology",1,"CGHS, MoHFW, NHM, PMSSY, NUHM"
Hospital #8,Guntur,Andhra Pradesh,Guntur,855.9,16.27782019913075,80.03962179597357,4.6,940,"Orthopedics, Dermatology",13,"MoHFW, NUHM, PMSSY, NHM, CGHS, OPD"
Hospital #9,Guntur,Andhra Pradesh,Guntur,855.9,16.338983834280008,80.55891798770435,4.0,38,Psychiatry,36,"NUHM, AIIMS, PMSSY, MoHFW, NHA"
Hospital #10,Guntur,Andhra Pradesh,Guntur,855.9,16.276937603022017,80.43699795995973,4.8,1989,"Gynecology, Urology",19,"MoHFW, NUHM, NRHM, OPD, PMSSY, AB-PMJAY"
Hospital #11,Guntur,Andhra Pradesh,Guntur,855.9,16.35681097694647,80.41093695828027,4.3,439,"Endocrinology, Pediatrics",17,"PMSSY, NHM, NUHM, AIIMS, OPD, AB-PMJAY"
Hospital #12,Guntur,Andhra Pradesh,Guntur,855.9,16.248378192058112,80.36956293029205,4.0,392,Dermatology,21,"NRHM, OPD, CGHS, PMSSY, MoHFW, NUHM"
Hospital #13,Guntur,Andhra Pradesh,Guntur,855.9,16.39529729071638,80.50233162057708,3.1,487,Psychiatry,21,"AIIMS, PMSSY, CGHS, NHA, AB-PMJAY, NRHM"
Hospital #14,Guntur,Andhra Pradesh,Guntur,855.9,16.250507659236455,80.35677880705212,3.0,252,"Neurology, Endocrinology",37,"OPD, PMSSY, CGHS, AIIMS, NUHM"
Hospital #15,Guntur,Andhra Pradesh,Guntur,855.9,16.23115384908339,80.48399400837442,2.7,26,Gastroenterology,43,"AIIMS, AB-PMJAY, NHA, PMSSY, CGHS"
Hospital #16,Guntur,Andhra Pradesh,Guntur,855.9,16.486378855179915,80.04728021729382,3.4,76,Cardiology,14,"AIIMS, NHM, PMSSY, OPD, AB-PMJAY, MoHFW"
Hospital #17,Guntur,Andhra Pradesh,Guntur,855.9,16.284372299701715,80.40853384583733,4.7,913,Dermatology,33,"NRHM, CGHS, OPD, AIIMS, MoHFW"
Hospital #18,Guntur,Andhra Pradesh,Guntur,855.9,16.314286291683274,80.4597193136164,4.6,575,"Neurology, Orthopedics",19,"NHA, OPD, NHM, PMSSY, AIIMS, MoHFW"
Hospital #19,Guntur,Andhra Pradesh,Guntur,855.9,16.3243416329625,80.41280052571909,4.7,317,Pediatrics,22,"AB-PMJAY, NHM, NRHM, OPD, AIIMS"
Hospital #20,Guntur,Andhra Pradesh,Guntur,855.9,16.29513292333803,80.4316695289919,4.4,281,"Urology, Neurology",22,"NUHM, NHA, PMSSY, CGHS, MoHFW, AB-PMJAY"
Hospital #21,Guntur,Andhra Pradesh,Guntur,855.9,16.200465367682924,80.00290279776303,4.0,34,General Surgery,39,"CGHS, OPD, NHM, PMSSY, NRHM"
Hospital #22,Guntur,Andhra Pradesh,Guntur,855.9,16.30249851437953,80.43413724244195,4.6,575,Ophthalmology,22,"OPD, NRHM, AIIMS, NUHM, MoHFW, NHM"
Hospital #23,Guntur,Andhra Pradesh,Guntur,855.9,16.250142607358754,80.37129326808581,4.3,116,"Neurology, Dermatology",33,"OPD, AIIMS, CGHS, NHM, NUHM, PMSSY"
Hospital #24,Guntur,Andhra Pradesh,Guntur,855.9,16.34687162003222,80.55983634446578,4.2,16,Gastroenterology,26,"MoHFW, OPD, PMSSY, CGHS, NHA"
Hospital #25,Guntur,Andhra Pradesh,Guntur,855.9,16.410068089043385,80.40154284396147,3.2,142,"Endocrinology, Gastroenterology",7,"CGHS, NRHM, AB-PMJAY, OPD, NUHM"
Hospital #26,Guntur,Andhra Pradesh,Guntur,855.9,16.307280099983082,80.42794990894367,4.6,443,Pediatrics,29,"AB-PMJAY, NRHM, NUHM, OPD, MoHFW"
Hospital #27,Guntur,Andhra Pradesh,Guntur,855.9,16.337919417440453,79.95152324445125,2.6,30,Dermatology,21,"AIIMS, OPD, CGHS, AB-PMJAY, NRHM"
Hospital #28,Guntur,Andhra Pradesh,Guntur,855.9,16.301770681777008,80.44456970332085,4.8,19688,"Cardiology, Gynecology",21,"AIIMS, CGHS, MoHFW, OPD, AB-PMJAY"
Hospital #29,Guntur,Andhra Pradesh,Guntur,855.9,16.38517875460687,80.30051259374858,3.2,161,"Neurology, Cardiology",27,"AB-PMJAY, NHA, NHM, NUHM, AIIMS, PMSSY"
Hospital #30,Guntur,Andhra Pradesh,Guntur,855.9,16.066828712528896,80.42686360085742,5.0,2,"Psychiatry, Pediatrics",13,"AB-PMJAY, NUHM, NHA, AIIMS, CGHS"
Hospital #31,Guntur,Andhra Pradesh,Guntur,855.9,16.30284318872382,80.51240553090143,2.7,168,"Endocrinology, Dermatology",16,"AIIMS, PMSSY, AB-PMJAY, MoHFW, NUHM, OPD"
Hospital #32,Guntur,Andhra Pradesh,Guntur,855.9,16.353511834690217,80.39153042579285,4.3,28,"Oncology, Pediatrics",22,"NHA, AB-PMJAY, CGHS, AIIMS, NHM"
Hospital #33,Guntur,Andhra Pradesh,Guntur,855.9,16.337472725646204,80.44539567392478,4.4,2171,"Orthopedics, Pulmonology",19,"AIIMS, PMSSY, NHM, NUHM, CGHS"
Hospital #34,Guntur,Andhra Pradesh,Guntur,855.9,16.240588758064305,80.1089528676354,2.3,92,Dermatology,20,"NHA, MoHFW, AB-PMJAY, NHM, NUHM, CGHS"
Hospital #35,Guntur,Andhra Pradesh,Guntur,855.9,16.45554293378526,80.50209767997183,4.0,9,Psychiatry,7,"NUHM, AIIMS, MoHFW, OPD, PMSSY"
Hospital #36,Guntur,Andhra Pradesh,Guntur,855.9,16.273210095236287,80.46126205700541,4.5,479,"Orthopedics, Endocrinology",28,"OPD, AIIMS, PMSSY, NRHM, NHM"
Hospital #37,Guntur,Andhra Pradesh,Guntur,855.9,16.37446863527412,80.52953321710174,4.0,45,"Gastroenterology, Dermatology",20,"AB-PMJAY, MoHFW, NRHM, NUHM, AIIMS"
Hospital #38,Guntur,Andhra Pradesh,Guntur,855.9,16.37496436323442,80.31089032511025,5.0,11,"Gastroenterology, Pulmonology",23,"NHA, NRHM, CGHS, AIIMS, OPD, NHM"
Hospital #39,Guntur,Andhra Pradesh,Guntur,855.9,16.38769581036906,80.08647938453377,3.2,13,Cardiology,14,"AB-PMJAY, MoHFW, NRHM, NHA, PMSSY, NUHM"
Hospital #40,Guntur,Andhra Pradesh,Guntur,855.9,16.3126256896706,80.47413895638394,4.1,439,Gynecology,32,"AB-PMJAY, NHM, NUHM, PMSSY, OPD"
Hospital #41,Guntur,Andhra Pradesh,Guntur,855.9,16.3434197397175,80.44037332268107,4.6,742,Ophthalmology,14,"MoHFW, NHA, CGHS, OPD, NUHM"
Hospital #42,Guntur,Andhra Pradesh,Guntur,855.9,14.341428353881549,78.77691679863644,2.9,28,Pediatrics,19,"AB-PMJAY, PMSSY, MoHFW, CGHS, NHM, NRHM"
Hospital #43,Kadapa,Andhra Pradesh,Ysr Kadapa,183.532,14.466520400587791,78.84326319114953,3.9,162,Nephrology,24,"AB-PMJAY, NHA, NHM, CGHS, AIIMS"
Hospital #44,Kadapa,Andhra Pradesh,Ysr Kadapa,183.532,14.484706992506537,78.80586845894406,3.7,180,Endocrinology,33,"PMSSY, OPD, CGHS, AIIMS, NUHM"
Hospital #45,Kadapa,Andhra Pradesh,Ysr Kadapa,183.532,14.470661640087528,78.82192448770056,4.9,1889,"Ophthalmology, Gynecology",4,"PMSSY, MoHFW, NHA, NHM, NUHM"
Hospital #46,Kadapa,Andhra Pradesh,Ysr Kadapa,183.532,14.458795384994133,78.83310235486508,3.3,57,Orthopedics,15,"PMSSY, AIIMS, NHA, OPD, NHM"
Hospital #47,Kadapa,Andhra Pradesh,Ysr Kadapa,183.532,14.505292878714704,78.75341414085172,3.3,89,Dermatology,38,"AIIMS, NHM, NHA, NRHM, CGHS, NUHM"
Hospital #48,Kadapa,Andhra Pradesh,Ysr Kadapa,183.532,14.469167252919728,78.81863393078899,2.8,135,Gynecology,25,"MoHFW, NRHM, NHA, PMSSY, NHM, CGHS"
Hospital #49,Kakinada,Andhra Pradesh,Kakinada,693.04,17.033348253057497,82.22018896672532,4.9,4941,"Urology, Orthopedics",12,"PMSSY, NHM, AIIMS, NRHM, OPD, NUHM"
Hospital #50,Kakinada,Andhra Pradesh,Kakinada,693.04,15.827262948027276,78.04021836041206,4.7,2160,Urology,12,"AIIMS, PMSSY, NHA, NHM, NRHM"
Hospital #51,Kurnool,Andhra Pradesh,Kurnool,284.67,15.833251856909897,78.03491913940833,4.8,1359,"Orthopedics, Ophthalmology",4,"NHM, AB-PMJAY, PMSSY, NRHM, CGHS"
Hospital #52,Kurnool,Andhra Pradesh,Kurnool,284.67,15.770867406890616,78.03947406362373,3.6,414,"Neurology, Gynecology",12,"AB-PMJAY, MoHFW, OPD, NHA, NHM, NRHM"
Hospital #53,Kurnool,Andhra Pradesh,Kurnool,284.67,15.444278311724698,78.49048458684956,3.2,84,"Dermatology, Gastroenterology",17,"NRHM, NHM, NHA, MoHFW, OPD"
Hospital #54,Kurnool,Andhra Pradesh,Kurnool,284.67,15.478322619967628,78.47812322945379,4.2,100,"Ophthalmology, Nephrology",12,"MoHFW, NUHM, NHM, AB-PMJAY, NRHM"
Hospital #55,Kurnool,Andhra Pradesh,Kurnool,284.67,15.491595691581466,78.4669140700423,4.7,7615,"Pulmonology, Gastroenterology",11,"NHM, CGHS, OPD, MoHFW, AB-PMJAY, NRHM"
Hospital #56,Nandyal,Andhra Pradesh,Nandyal,184.032,15.463547925124136,78.52193415946226,3.3,59,Dermatology,19,"PMSSY, NRHM, NUHM, OPD, NHA"
Hospital #57,Nandyal,Andhra Pradesh,Nandyal,184.032,15.514889654516594,78.49942338658286,3.4,25,Neurology,10,"NHM, NHA, NUHM, PMSSY, OPD"
Hospital #58,Nandyal,Andhra Pradesh,Nandyal,184.032,15.48727483242105,78.4296866823078,3.7,232,Psychiatry,1,"CGHS, AB-PMJAY, AIIMS, OPD, NUHM, MoHFW"
Hospital #59,Nandyal,Andhra Pradesh,Nandyal,184.032,15.389756601796671,78.4469496045302,4.2,24,"Psychiatry, Orthopedics",3,"MoHFW, NRHM, NHM, OPD, AIIMS"
Hospital #60,Nelamangala,Andhra Pradesh,Bangalore Rural,441.0,18.1670625,83.4464929,4.0,73,"Neurology, Ophthalmology",21,"NUHM, NHA, CGHS, PMSSY, AIIMS, OPD"
Hospital #61,Nellore,Andhra Pradesh,Nellore,236.0,14.410310751497176,80.00197981156052,3.5,66,Gastroenterology,13,"CGHS, NHA, OPD, AIIMS, NRHM"
Hospital #62,Nellore,Andhra Pradesh,Nellore,236.0,14.530603915925036,79.95286473075723,3.9,67,Psychiatry,18,"NHM, OPD, MoHFW, NUHM, AB-PMJAY"
Hospital #63,Nellore,Andhra Pradesh,Nellore,236.0,14.442023929923684,79.95349572002995,4.9,105,"Neurology, Orthopedics",5,"NUHM, MoHFW, NHA, CGHS, NRHM, PMSSY"
Hospital #64,Nellore,Andhra Pradesh,Nellore,236.0,14.417458910672469,79.92314950582002,3.9,21,Dermatology,27,"MoHFW, CGHS, AIIMS, NUHM, OPD, NHA"
Hospital #65,Nellore,Andhra Pradesh,Nellore,236.0,14.5000445864409,79.94529820442895,4.5,20,Urology,22,"NHA, NUHM, NHM, OPD, NRHM, CGHS"
Hospital #66,Nellore,Andhra Pradesh,Nellore,236.0,14.43669262995099,79.9928041986446,4.9,13062,Pediatrics,44,"PMSSY, NHM, AB-PMJAY, NUHM, MoHFW"
Hospital #67,Nellore,Andhra Pradesh,Nellore,236.0,14.471349234463815,79.97068964116961,4.1,90,Psychiatry,27,"NRHM, AB-PMJAY, OPD, NHA, NHM"
Hospital #68,Nellore,Andhra Pradesh,Nellore,236.0,14.456045577253152,79.9838487933919,4.7,1845,Orthopedics,21,"NUHM, PMSSY, NHA, AIIMS, MoHFW"
Hospital #69,Nellore,Andhra Pradesh,Nellore,236.0,14.130460407170151,79.88333900810004,4.0,151,"Orthopedics, Psychiatry",24,"PMSSY, OPD, AB-PMJAY, MoHFW, NRHM, NHM"
Hospital #70,Nellore,Andhra Pradesh,Nellore,236.0,14.378376542779534,79.9891380609805,3.6,132,"Cardiology, Gynecology",9,"NUHM, PMSSY, AB-PMJAY, NHM, NRHM, NHA"
Hospital #71,Nellore,Andhra Pradesh,Nellore,236.0,14.47063612237027,79.97359550436475,4.6,15,"Ophthalmology, Orthopedics",22,"NHA, PMSSY, OPD, NHM, NRHM, NUHM"
Hospital #72,Nellore,Andhra Pradesh,Nellore,236.0,14.442501647978675,79.9789955769064,4.1,229,"Orthopedics, Neurology",7,"NRHM, CGHS, NHA, OPD, NHM, MoHFW"
Hospital #73,Nellore,Andhra Pradesh,Nellore,236.0,14.42941602207874,79.9910566053979,4.1,199,"Nephrology, Endocrinology",11,"NUHM, CGHS, AIIMS, NRHM, PMSSY, AB-PMJAY"
Hospital #74,Nellore,Andhra Pradesh,Nellore,236.0,14.460074264769023,80.00368004755758,3.0,29,"General Surgery, Gynecology",21,"NHA, OPD, CGHS, NUHM, AIIMS, AB-PMJAY"
Hospital #75,Nellore,Andhra Pradesh,Nellore,236.0,14.45578580899101,79.92091253084178,4.3,82,"Pulmonology, Psychiatry",17,"CGHS, NHA, AIIMS, NRHM, NHM, NUHM"
Hospital #76,Ongole,Andhra Pradesh,Prakasam,160.0,15.50592427373531,80.03080159392952,3.6,35,"Cardiology, Oncology",27,"OPD, NHA, CGHS, NHM, PMSSY, MoHFW"
Hospital #77,Ongole,Andhra Pradesh,Prakasam,160.0,15.497340729114214,80.03480417706339,4.4,40,"Gynecology, Cardiology",20,"AB-PMJAY, OPD, NHA, MoHFW, NRHM, CGHS"
Hospital #78,Ongole,Andhra Pradesh,Prakasam,160.0,15.622570449314928,79.99142191394283,3.1,47,Dermatology,17,"NUHM, CGHS, AB-PMJAY, MoHFW, PMSSY"
Hospital #79,Ongole,Andhra Pradesh,Prakasam,160.0,15.520991705551506,80.03092807425688,4.7,193,Nephrology,25,"PMSSY, CGHS, NUHM, AB-PMJAY, MoHFW, NRHM"
Hospital #80,Ongole,Andhra Pradesh,Prakasam,160.0,15.556692014821657,80.05001988773634,3.8,47,Dermatology,12,"NHM, PMSSY, OPD, NUHM, AIIMS"
Hospital #81,Ongole,Andhra Pradesh,Prakasam,160.0,15.512155796830662,80.05025315468981,3.6,103,"Cardiology, General Surgery",18,"OPD, PMSSY, NRHM, CGHS, NHM"
Hospital #82,Proddutur,Andhra Pradesh,Ysr Kadapa,183.532,14.70350719098175,78.54262760917568,4.3,11,Pulmonology,15,"AIIMS, CGHS, NHM, NHA, NUHM, OPD"
Hospital #83,Proddutur,Andhra Pradesh,Ysr Kadapa,183.532,14.795061323780608,78.51921981549705,3.8,33,Nephrology,11,"OPD, CGHS, NRHM, NUHM, PMSSY, AB-PMJAY"
Hospital #84,Proddutur,Andhra Pradesh,Ysr Kadapa,183.532,14.745297847268636,78.51729858922384,3.6,33,"Gynecology, Urology",21,"OPD, NHA, PMSSY, NUHM, AIIMS, NRHM"
Hospital #85,Rajahmundry,Andhra Pradesh,East Godavari,715.46,17.028181883282425,81.81210307578621,5.0,190,Nephrology,18,"MoHFW, OPD, AIIMS, CGHS, PMSSY, NHM"
Hospital #86,Srikakulam,Andhra Pradesh,Srikakulam,477.34,16.580504256552313,81.70734518769693,3.5,26,Cardiology,14,"PMSSY, AB-PMJAY, NUHM, AIIMS, CGHS, OPD"
Hospital #87,Tadepalligudem,Andhra Pradesh,West Godavari,817.3,16.826144322733317,81.77596877192055,4.0,41,"Gynecology, Neurology",12,"NUHM, NHA, NHM, CGHS, PMSSY"
Hospital #88,Tanuku,Andhra Pradesh,West Godavari,817.3,16.815795444837967,81.6797409051013,3.8,76,"Psychiatry, Neurology",38,"OPD, NRHM, CGHS, PMSSY, NHA"
Hospital #89,Tanuku,Andhra Pradesh,West Godavari,817.3,16.746191776714536,81.7246141001579,4.6,37,Pulmonology,6,"NUHM, NHM, PMSSY, AB-PMJAY, NHA, MoHFW"
Hospital #90,Tanuku,Andhra Pradesh,West Godavari,817.3,16.762792264860575,81.67061553653826,4.4,132,"General Surgery, Pediatrics",14,"NUHM, PMSSY, AIIMS, MoHFW, OPD"
Hospital #91,Tirupati,Andhra Pradesh,Tirupati,241.72,13.595494866272436,79.40312800341576,3.8,102,Gastroenterology,20,"OPD, NUHM, PMSSY, AB-PMJAY, MoHFW"
Hospital #92,Tirupati,Andhra Pradesh,Tirupati,241.72,13.634939344525272,79.42737863304455,4.3,1080,"Cardiology, Pulmonology",22,"NHA, NHM, OPD, AIIMS, NUHM, NRHM"
Hospital #93,Tirupati,Andhra Pradesh,Tirupati,241.72,13.616664487787382,79.41373341935443,4.5,92,Cardiology,15,"AIIMS, MoHFW, OPD, NUHM, AB-PMJAY, NHM"
Hospital #94,Tirupati,Andhra Pradesh,Tirupati,241.72,13.621316502868416,79.40268717421604,4.2,90,Nephrology,26,"PMSSY, CGHS, MoHFW, OPD, NRHM, NUHM"
Hospital #95,Tirupati,Andhra Pradesh,Tirupati,241.72,13.626769326653868,79.34083407059133,4.6,57,Pulmonology,14,"NHA, AIIMS, MoHFW, CGHS, NUHM"
Hospital #96,Tirupati,Andhra Pradesh,Tirupati,241.72,13.664737526641154,79.44644016229505,4.2,132,Ophthalmology,27,"NRHM, AIIMS, MoHFW, NHM, OPD, AB-PMJAY"
Hospital #97,Tirupati,Andhra Pradesh,Tirupati,241.72,13.608188064858153,79.3799867758066,3.6,203,"Psychiatry, Gynecology",1,"MoHFW, AB-PMJAY, NHM, NUHM, PMSSY, AIIMS"
Hospital #98,Tirupati,Andhra Pradesh,Tirupati,241.72,13.640461036155298,79.44457309964778,4.4,392,General Surgery,15,"MoHFW, NRHM, AIIMS, AB-PMJAY, NHA, NUHM"
Hospital #99,Tirupati,Andhra Pradesh,Tirupati,241.72,13.629339334640957,79.39382699525872,4.3,1449,Neurology,15,"NHM, NUHM, NRHM, PMSSY, CGHS"
Hospital #100,Tirupati,Andhra Pradesh,Tirupati,241.72,13.561225705555335,79.36541006259053,4.4,59,"Neurology, Pulmonology",19,"OPD, PMSSY, NHA, AB-PMJAY, MoHFW"
Hospital #101,Tirupati,Andhra Pradesh,Tirupati,241.72,13.639744504079292,79.40858656089063,3.9,117,"Urology, Psychiatry",36,"CGHS, NHM, OPD, AB-PMJAY, PMSSY, NUHM"
Hospital #102,Tirupati,Andhra Pradesh,Tirupati,241.72,13.641819170632251,79.42144215430585,4.7,1239,"Pediatrics, Pulmonology",14,"CGHS, NUHM, MoHFW, OPD, NRHM"
Hospital #103,Tirupati,Andhra Pradesh,Tirupati,241.72,13.630097389654528,79.4509831413769,4.9,9953,Ophthalmology,28,"AB-PMJAY, NUHM, AIIMS, MoHFW, OPD"
Hospital #104,Vijayawada,Andhra Pradesh,Krishna,459.602,16.510485151288297,80.59290771939907,4.6,2201,"Cardiology, Gynecology",31,"NUHM, MoHFW, AIIMS, NHA, NHM, NRHM"
Hospital #105,Vijayawada,Andhra Pradesh,Krishna,459.602,16.4931736869628,80.5834832962945,4.2,819,Endocrinology,26,"NHA, AIIMS, NHM, NUHM, AB-PMJAY"
Hospital #106,Vijayawada,Andhra Pradesh,Krishna,459.602,16.47325813727966,80.60520535572579,4.7,7951,"Ophthalmology, Orthopedics",37,"NHA, CGHS, NHM, OPD, NUHM"
Hospital #107,Vijayawada,Andhra Pradesh,Krishna,459.602,16.49614400981399,80.58969706764677,4.8,6594,Endocrinology,23,"AB-PMJAY, PMSSY, NHM, NRHM, CGHS"
Hospital #108,Vijayawada,Andhra Pradesh,Krishna,459.602,16.467543272911264,80.65036148357943,4.3,96,Dermatology,22,"AB-PMJAY, NRHM, PMSSY, NUHM, CGHS"
Hospital #109,Vijayawada,Andhra Pradesh,Krishna,459.602,16.491734702981407,80.66795144861761,4.7,4262,Pulmonology,18,"OPD, MoHFW, NHM, NRHM, PMSSY"
Hospital #110,Vijayawada,Andhra Pradesh,Krishna,459.602,16.525618629661558,80.61319055790234,3.7,295,"Endocrinology, Pediatrics",24,"NUHM, PMSSY, NHM, AIIMS, CGHS"
Hospital #111,Vijayawada,Andhra Pradesh,Krishna,459.602,16.51998518625105,80.63033904706388,3.6,149,Orthopedics,24,"MoHFW, PMSSY, AB-PMJAY, NUHM, AIIMS"
Hospital #112,Vijayawada,Andhra Pradesh,Krishna,459.602,16.502710180198143,80.66426228359472,4.6,1297,Dermatology,20,"AIIMS, CGHS, AB-PMJAY, NHA, NUHM"
Hospital #113,Vijayawada,Andhra Pradesh,Krishna,459.602,16.50198909810127,80.62938333737694,4.5,811,Nephrology,1,"OPD, NRHM, NHM, AIIMS, MoHFW, NHA"
Hospital #114,Vijayawada,Andhra Pradesh,Krishna,459.602,16.39566000673991,80.53196827166262,5.0,1,Gastroenterology,16,"MoHFW, OPD, NRHM, CGHS, NUHM, NHA"
Hospital #115,Vijayawada,Andhra Pradesh,Krishna,459.602,16.539703008476824,80.67391463565193,4.3,1899,Pediatrics,19,"NUHM, OPD, AIIMS, NHM, AB-PMJAY"
Hospital #116,Vijayawada,Andhra Pradesh,Krishna,459.602,16.46347418664767,80.68094646041104,3.6,127,General Surgery,16,"AB-PMJAY, PMSSY, NHM, CGHS, MoHFW"
Hospital #117,Vijayawada,Andhra Pradesh,Krishna,459.602,16.538526063401623,80.59906437555853,3.2,115,"Neurology, Urology",29,"CGHS, AB-PMJAY, NHM, MoHFW, NHA, NUHM"
Hospital #118,Vijayawada,Andhra Pradesh,Krishna,459.602,16.490882102643873,80.60690639875773,4.8,6594,"Endocrinology, Psychiatry",22,"NHM, OPD, AB-PMJAY, MoHFW, AIIMS"
Hospital #119,Vijayawada,Andhra Pradesh,Krishna,459.602,16.503732515539028,80.64407195911981,4.5,1609,"Gastroenterology, Endocrinology",12,"AIIMS, AB-PMJAY, MoHFW, NHA, PMSSY"
Hospital #120,Vijayawada,Andhra Pradesh,Krishna,459.602,16.551859470943207,80.73015999389806,4.0,80,"Cardiology, Urology",16,"OPD, MoHFW, NHA, NUHM, AB-PMJAY, AIIMS"
Hospital #121,Vijayawada,Andhra Pradesh,Krishna,459.602,16.22501820029611,80.72225660863606,3.3,4,Cardiology,9,"PMSSY, AIIMS, NHM, NHA, AB-PMJAY"
Hospital #122,Vijaywada,Andhra Pradesh,Krishna,459.602,16.5063708257186,80.60547561186917,4.9,5511,"Nephrology, General Surgery",26,"AB-PMJAY, NUHM, NRHM, MoHFW, AIIMS"
Hospital #123,Vijaywada,Andhra Pradesh,Krishna,459.602,16.57496946794992,80.5339256079703,4.5,21,Pediatrics,17,"NHM, NUHM, NRHM, CGHS, OPD"
Hospital #124,Vijaywada,Andhra Pradesh,Krishna,459.602,16.51056210462941,80.69476758725568,4.7,2035,"Urology, Endocrinology",28,"AIIMS, PMSSY, CGHS, MoHFW, OPD"
Hospital #125,Vijaywada,Andhra Pradesh,Krishna,459.602,16.489032683982018,80.5925762541472,4.0,63,Endocrinology,20,"OPD, MoHFW, NHA, NUHM, AB-PMJAY"
Hospital #126,Vijaywada,Andhra Pradesh,Krishna,459.602,16.501845791909652,80.80125722148372,3.0,89,"General Surgery, Oncology",28,"AIIMS, OPD, PMSSY, AB-PMJAY, MoHFW"
Hospital #127,Vijaywada,Andhra Pradesh,Krishna,459.602,16.52557298382739,80.62671607419266,2.9,531,"Psychiatry, Gynecology",39,"NHA, NUHM, NRHM, OPD, CGHS"
Hospital #128,Vijaywada,Andhra Pradesh,Krishna,459.602,16.655084650826634,80.77154243353077,5.0,1,Orthopedics,6,"OPD, NUHM, AB-PMJAY, NRHM, NHA, AIIMS"
Hospital #129,Vijaywada,Andhra Pradesh,Krishna,459.602,16.385556695409537,80.40528360976532,3.7,3,"Ophthalmology, Gastroenterology",14,"CGHS, AB-PMJAY, PMSSY, NUHM, NHA, MoHFW"
Hospital #130,Vijaywada,Andhra Pradesh,Krishna,459.602,16.522763750860335,80.63159672160208,4.6,70,Endocrinology,6,"AIIMS, AB-PMJAY, OPD, NRHM, CGHS, NUHM"
Hospital #131,Visakhapatnam,Andhra Pradesh,Visakhapatnam,1869.8,17.667822292413955,83.33556687867267,4.5,185,"Pulmonology, Urology",29,"NHM, CGHS, NHA, AIIMS, AB-PMJAY, NRHM"
Hospital #132,Visakhapatnam,Andhra Pradesh,Visakhapatnam,1869.8,17.913677111784963,83.57976711461774,2.9,18,"Oncology, Urology",11,"AB-PMJAY, MoHFW, CGHS, NHM, OPD, PMSSY"
Hospital #133,Visakhapatnam,Andhra Pradesh,Visakhapatnam,1869.8,17.723589252087592,83.3044705107623,4.1,1893,Gastroenterology,22,"NHA, OPD, NUHM, MoHFW, AB-PMJAY, NRHM"
Hospital #134,Visakhapatnam,Andhra Pradesh,Visakhapatnam,1869.8,17.720664513140477,83.31476180614747,4.3,739,Urology,19,"AB-PMJAY, CGHS, AIIMS, NRHM, PMSSY"
Hospital #135,Visakhapatnam,Andhra Pradesh,Visakhapatnam,1869.8,17.712577776448352,83.29666865995605,4.5,892,Pediatrics,15,"AIIMS, NHM, CGHS, MoHFW, NUHM, OPD"
Hospital #136,Visakhapatnam,Andhra Pradesh,Visakhapatnam,1869.8,17.73562872311609,83.29119067859388,3.5,103,Nephrology,22,"NHM, NUHM, NRHM, CGHS, PMSSY"
Hospital #137,Visakhapatnam,Andhra Pradesh,Visakhapatnam,1869.8,17.588223794310938,83.23512654745976,2.9,68,"Gastroenterology, General Surgery",8,"CGHS, OPD, NHA, AB-PMJAY, PMSSY"
Hospital #138,Visakhapatnam,Andhra Pradesh,Visakhapatnam,1869.8,17.723993917549137,83.28022134372048,4.8,3804,"Nephrology, Pediatrics",1,"AIIMS, AB-PMJAY, OPD, CGHS, NHA"
Hospital #139,Visakhapatnam,Andhra Pradesh,Visakhapatnam,1869.8,17.72872304458137,83.28788096076755,4.6,4917,Cardiology,35,"NRHM, AIIMS, NUHM, CGHS, NHA, NHM"
Hospital #140,Visakhapatnam,Andhra Pradesh,Visakhapatnam,1869.8,17.73096551108286,83.30607488010678,4.0,136,"Ophthalmology, Psychiatry",28,"PMSSY, NHA, MoHFW, NRHM, CGHS, NHM"
Hospital #141,Visakhapatnam,Andhra Pradesh,Visakhapatnam,1869.8,17.722591557192708,83.18992755398475,4.6,19600,Pulmonology,9,"MoHFW, CGHS, NRHM, OPD, AIIMS, AB-PMJAY"
Hospital #142,Visakhapatnam,Andhra Pradesh,Visakhapatnam,1869.8,17.776889376851475,83.16773950460808,3.1,137,Gastroenterology,29,"NUHM, NHA, AIIMS, MoHFW, PMSSY, NRHM"
Hospital #143,Visakhapatnam,Andhra Pradesh,Visakhapatnam,1869.8,17.746367506941578,83.32876869143361,4.9,5864,Dermatology,29,"AIIMS, NUHM, NHM, NRHM, AB-PMJAY, OPD"
Hospital #144,Visakhapatnam,Andhra Pradesh,Visakhapatnam,1869.8,17.67588146931173,83.33647267930243,4.0,262,Gastroenterology,20,"MoHFW, OPD, NHA, NRHM, AB-PMJAY"
Hospital #145,Visakhapatnam,Andhra Pradesh,Visakhapatnam,1869.8,17.734466034331238,83.2881362329191,4.1,1418,Pediatrics,1,"AB-PMJAY, NHM, OPD, MoHFW, AIIMS"
Hospital #146,Visakhapatnam,Andhra Pradesh,Visakhapatnam,1869.8,17.684085595634606,83.19157334180719,3.0,141,"Ophthalmology, Pediatrics",13,"NHA, MoHFW, AB-PMJAY, AIIMS, CGHS, NRHM"
Hospital #147,Visakhapatnam,Andhra Pradesh,Visakhapatnam,1869.8,17.80116432928278,83.40645445307408,3.0,160,"Pediatrics, Endocrinology",8,"NHM, NHA, AIIMS, CGHS, PMSSY, NRHM"
Hospital #148,Visakhapatnam,Andhra Pradesh,Visakhapatnam,1869.8,17.76397891160117,83.2806040528482,4.5,2079,Endocrinology,18,"PMSSY, AIIMS, NRHM, NHA, MoHFW, NUHM"
Hospital #149,Visakhapatnam,Andhra Pradesh,Visakhapatnam,1869.8,17.91360592392028,83.36939613814201,4.3,16,Dermatology,24,"NRHM, MoHFW, CGHS, PMSSY, OPD"
Hospital #150,Visakhapatnam,Andhra Pradesh,Visakhapatnam,1869.8,17.70332331964755,83.36145202995594,3.5,144,Cardiology,8,"OPD, PMSSY, AB-PMJAY, CGHS, NHM"
Hospital #151,Visakhapatnam,Andhra Pradesh,Visakhapatnam,1869.8,17.795762926125985,83.39529621538634,4.5,51,Nephrology,31,"NHM, AB-PMJAY, CGHS, NRHM, AIIMS"
Hospital #152,Visakhapatnam,Andhra Pradesh,Visakhapatnam,1869.8,17.69647167151717,83.27886265184665,4.2,131,"Oncology, Neurology",33,"PMSSY, OPD, NUHM, AIIMS, NHM"
Hospital #153,Visakhapatnam,Andhra Pradesh,Visakhapatnam,1869.8,17.74959756897612,82.9516131681602,3.5,16,Nephrology,32,"NRHM, MoHFW, AB-PMJAY, NUHM, AIIMS"
Hospital #154,Visakhapatnam,Andhra Pradesh,Visakhapatnam,1869.8,17.738409851016772,83.29692207268167,4.8,691,"Pediatrics, Dermatology",12,"NUHM, CGHS, NRHM, PMSSY, OPD, AB-PMJAY"
Hospital #155,West Godavari,Andhra Pradesh,West Godavari,817.3,16.745326550664483,81.67832754434282,4.5,1868,"General Surgery, Oncology",30,"NHM, MoHFW, CGHS, AIIMS, PMSSY, AB-PMJAY"
Hospital #156,West Godavari,Andhra Pradesh,West Godavari,817.3,16.471953117218145,81.67145293830097,3.4,5,"Urology, Dermatology",31,"NUHM, NHA, CGHS, MoHFW, NRHM"
Hospital #157,West Godavari,Andhra Pradesh,West Godavari,817.3,16.49857513265502,81.72244904934254,4.1,8,"Dermatology, Oncology",26,"CGHS, NHA, NRHM, PMSSY, AIIMS"
Hospital #158,West Godavari,Andhra Pradesh,West Godavari,817.3,16.398708386685218,81.71232780849566,2.3,18,Pulmonology,32,"NRHM, NUHM, AB-PMJAY, NHA, AIIMS, PMSSY"
Hospital #159,Dibrugarh,Assam,Dibrugarh,393.0,26.19908213905008,91.65079248792232,4.5,105,Gynecology,17,"PMSSY, MoHFW, AB-PMJAY, NHM, NUHM"
Hospital #160,Dibrugarh,Assam,Dibrugarh,393.0,26.18821047570896,91.62093075782472,3.5,6,Ophthalmology,10,"AIIMS, CGHS, AB-PMJAY, NRHM, NHA, NHM"
Hospital #161,Guwahati,Assam,Kamrup Metropolitan,2010.0,26.21066729458935,91.67003012258829,4.8,6491,"Pulmonology, Orthopedics",19,"NRHM, CGHS, NUHM, AIIMS, AB-PMJAY, NHM"
Hospital #162,Guwahati,Assam,Kamrup Metropolitan,2010.0,26.186823692660216,91.73808175382877,4.9,4024,"Cardiology, Endocrinology",11,"NHA, CGHS, PMSSY, NRHM, NUHM"
Hospital #163,Guwahati,Assam,Kamrup Metropolitan,2010.0,26.156640988631167,91.75155815231136,4.8,92,Gastroenterology,24,"NUHM, AIIMS, CGHS, PMSSY, MoHFW"
Hospital #164,Darbhanga,Bihar,Darbhanga,1721.0,26.1364375,85.9057429,3.5,678,Nephrology,12,"NHA, NRHM, CGHS, NHM, PMSSY, MoHFW"
