id,City,State,District,Density,Latitude,Longitude,Rating,Number of Reviews,Specialisation,No of Beds,Insurance Schemes
Hospital #1350,Thane,Maharashtra,Thane,1915.0,19.284051680132176,72.97532903920658,3.9,389,"Nephrology, Gastroenterology",13,"NRHM, PMSSY, MoHFW, AIIMS, NUHM, NHM"
Hospital #1351,Thane,Maharashtra,Thane,1915.0,19.2730375312297,72.83672114219175,4.2,3207,Pediatrics,16,"MoHFW, OPD, NRHM, NHM, NUHM, CGHS"
Hospital #1352,Thane,Maharashtra,Thane,1915.0,19.276971605259405,72.8817426545942,4.6,203,"General Surgery, Nephrology",8,"AIIMS, MoHFW, AB-PMJAY, NRHM, PMSSY, CGHS"
Hospital #1353,Thane,Maharashtra,Thane,1915.0,19.34286630952571,72.82811760153757,3.3,4,Pediatrics,32,"AIIMS, NHM, OPD, CGHS, NHA, NRHM"
Hospital #1354,Thane,Maharashtra,Thane,1915.0,19.161824651518128,72.96768652127957,3.8,78,"Dermatology, Endocrinology",21,"AB-PMJAY, OPD, AIIMS, CGHS, NHA"
Hospital #1355,Thane,Maharashtra,Thane,1915.0,19.30864197412093,72.85765677923075,3.5,264,"General Surgery, Psychiatry",27,"MoHFW, AIIMS, NHM, NUHM, NRHM"
Hospital #1356,Thane,Maharashtra,Thane,1915.0,19.44546436476868,72.82584432976326,4.6,534,General Surgery,7,"OPD, PMSSY, AIIMS, NHA, CGHS"
Hospital #1357,Thane,Maharashtra,Thane,1915.0,19.26451953356902,72.93452410437081,3.5,742,Orthopedics,15,"AIIMS, PMSSY, MoHFW, NRHM, AB-PMJAY"
Hospital #1358,Thane,Maharashtra,Thane,1915.0,19.2001273773946,72.86308179960477,4.2,61,Pediatrics,38,"AB-PMJAY, NHM, NUHM, AIIMS, OPD"
Hospital #1359,Thane,Maharashtra,Thane,1915.0,19.193468391279303,72.94429616265462,4.8,1863,Pulmonology,18,"MoHFW, NRHM, AIIMS, PMSSY, NUHM, NHA"
Hospital #1360,Thane,Maharashtra,Thane,1915.0,19.184710743961105,72.99109777613307,4.9,6,"General Surgery, Pulmonology",26,"NHM, NHA, PMSSY, AIIMS, AB-PMJAY, NRHM"
Hospital #1361,Thane,Maharashtra,Thane,1915.0,19.41341242218005,72.9864165150986,3.9,22,"Pulmonology, Oncology",21,"NHM, MoHFW, AB-PMJAY, NRHM, OPD"
Hospital #1362,Thane,Maharashtra,Thane,1915.0,19.301893807336217,73.13655055829473,4.6,1188,"Neurology, Urology",17,"NHA, NUHM, NHM, MoHFW, PMSSY, OPD"
Hospital #1363,Thane,Maharashtra,Thane,1915.0,19.246171129827864,73.06289219347049,2.7,39,Cardiology,20,"AIIMS, MoHFW, NHM, OPD, NRHM"
Hospital #1364,Thane,Maharashtra,Thane,1915.0,19.508301377236258,73.14885605948918,2.3,18,Urology,23,"PMSSY, NHM, MoHFW, CGHS, OPD, AB-PMJAY"
Hospital #1365,Thane,Maharashtra,Thane,1915.0,19.16442874816192,73.03157390846872,3.8,54,Endocrinology,18,"PMSSY, AB-PMJAY, NUHM, AIIMS, NHA"
Hospital #1366,Thane,Maharashtra,Thane,1915.0,19.207241255305263,72.93449355477105,4.1,9,"Gynecology, Pulmonology",27,"CGHS, AIIMS, OPD, PMSSY, MoHFW"
Hospital #1367,Thane,Maharashtra,Thane,1915.0,19.28922817083604,73.0080363713303,3.3,62,Neurology,36,"CGHS, NHM, OPD, NHA, PMSSY"
Hospital #1368,Thane,Maharashtra,Thane,1915.0,18.948333516524304,73.09207621589816,3.2,70,Orthopedics,25,"AB-PMJAY, NUHM, OPD, NRHM, NHA, AIIMS"
Hospital #1369,Thane,Maharashtra,Thane,1915.0,19.26373835686022,72.96182534578656,4.8,203,"Oncology, Orthopedics",12,"PMSSY, MoHFW, NHA, NHM, NRHM, OPD"
Hospital #1370,Thane,Maharashtra,Thane,1915.0,19.445455984142257,72.8362029982555,3.1,183,Orthopedics,24,"OPD, NRHM, AIIMS, AB-PMJAY, PMSSY, NHM"
Hospital #1371,Thane,Maharashtra,Thane,1915.0,19.262694070562656,73.05824458620293,4.0,102,"Oncology, Gastroenterology",25,"CGHS, NRHM, AIIMS, NHM, NUHM"
Hospital #1372,Thane,Maharashtra,Thane,1915.0,19.23516776874821,73.29213320569123,4.0,8,Gynecology,17,"MoHFW, PMSSY, NUHM, AB-PMJAY, AIIMS, OPD"
Hospital #1373,Thane,Maharashtra,Thane,1915.0,19.195236360872165,73.19519483552126,4.1,33,Pulmonology,20,"AIIMS, NHM, NHA, MoHFW, NUHM, PMSSY"
Hospital #1374,Thane,Maharashtra,Thane,1915.0,19.248832100052034,73.0816638148382,4.0,103,Pulmonology,18,"OPD, NHM, PMSSY, NRHM, NHA"
Hospital #1375,Thane,Maharashtra,Thane,1915.0,19.41330609279889,72.62186321835131,3.7,66,"Nephrology, Pediatrics",26,"OPD, NRHM, NHA, PMSSY, NHM"
Hospital #1376,Thane,Maharashtra,Thane,1915.0,19.20482586466857,72.89256596801184,4.7,71,Neurology,16,"OPD, AIIMS, NHA, PMSSY, NUHM, AB-PMJAY"
Hospital #1377,Thane,Maharashtra,Thane,1915.0,19.45908316090855,73.0838997548287,3.7,24,Psychiatry,22,"MoHFW, OPD, NRHM, NUHM, AB-PMJAY, CGHS"
Hospital #1378,Thane,Maharashtra,Thane,1915.0,19.29731166781454,72.84979322466012,3.8,70,"Oncology, Neurology",5,"NHA, AIIMS, AB-PMJAY, MoHFW, CGHS"
Hospital #1379,Thane,Maharashtra,Thane,1915.0,19.46166962425539,72.92910920184042,3.5,17,"Ophthalmology, Psychiatry",19,"AB-PMJAY, PMSSY, NRHM, NHA, OPD"
Hospital #1380,Thane,Maharashtra,Thane,1915.0,19.415886010100976,72.82326562874798,3.1,347,"Pulmonology, Ophthalmology",22,"MoHFW, NUHM, PMSSY, AB-PMJAY, OPD"
Hospital #1381,Thane,Maharashtra,Thane,1915.0,19.226947618913183,72.93643041477328,3.3,177,Ophthalmology,27,"AB-PMJAY, NRHM, PMSSY, OPD, CGHS"
Hospital #1382,Thane,Maharashtra,Thane,1915.0,19.19954884570245,72.80430230845177,3.7,51,"Cardiology, General Surgery",23,"NRHM, AB-PMJAY, MoHFW, OPD, NHA"
Hospital #1383,Thane,Maharashtra,Thane,1915.0,19.284732406981103,72.92665420162719,4.4,1353,"Gynecology, Gastroenterology",26,"CGHS, NUHM, MoHFW, NRHM, OPD"
Hospital #1384,Thane,Maharashtra,Thane,1915.0,19.21929202773689,72.58576374507908,2.3,9,"Gastroenterology, Pediatrics",34,"CGHS, AB-PMJAY, PMSSY, NRHM, AIIMS"
Hospital #1385,Thane,Maharashtra,Thane,1915.0,19.15360443814153,72.96012656390394,4.4,723,Nephrology,27,"PMSSY, NHM, NHA, AB-PMJAY, MoHFW"
Hospital #1386,Thane,Maharashtra,Thane,1915.0,19.31161702771184,73.08100517552079,4.1,160,Pediatrics,15,"NHA, OPD, MoHFW, CGHS, NRHM, AB-PMJAY"
Hospital #1387,Thane,Maharashtra,Thane,1915.0,19.23806901127332,72.97509779574841,4.4,258,General Surgery,23,"AIIMS, AB-PMJAY, NUHM, NHM, NRHM"
Hospital #1388,Thane,Maharashtra,Thane,1915.0,19.179250841360908,72.97845173622966,4.6,408,Psychiatry,20,"CGHS, NHA, AIIMS, OPD, NHM, NUHM"
Hospital #1389,Thane,Maharashtra,Thane,1915.0,18.9536666993629,73.22014804569618,4.9,2,Pulmonology,18,"AB-PMJAY, MoHFW, NUHM, AIIMS, NHM, PMSSY"
Hospital #1390,Thane,Maharashtra,Thane,1915.0,19.199976777175564,72.97253868013176,4.9,125,General Surgery,34,"CGHS, OPD, MoHFW, AB-PMJAY, PMSSY"
Hospital #1391,Thane,Maharashtra,Thane,1915.0,19.27135870032951,73.00464480390679,3.3,83,"Neurology, General Surgery",13,"AB-PMJAY, NUHM, CGHS, NHM, OPD"
Hospital #1392,Thane,Maharashtra,Thane,1915.0,19.12914734800496,72.94531547720662,4.0,13,Psychiatry,40,"MoHFW, NRHM, PMSSY, CGHS, NHA, OPD"
Hospital #1393,Thane,Maharashtra,Thane,1915.0,19.302742183886647,72.8615030937016,4.7,595,"Oncology, Pulmonology",1,"NHM, OPD, AIIMS, NUHM, NHA, NRHM"
Hospital #1394,Thane,Maharashtra,Thane,1915.0,19.231148657345805,72.97167442199435,4.5,851,"Psychiatry, Urology",9,"PMSSY, NHA, NRHM, NUHM, CGHS, MoHFW"
Hospital #1395,Thane,Maharashtra,Thane,1915.0,19.216138832059304,72.96163752583068,4.7,577,Nephrology,18,"NRHM, OPD, AB-PMJAY, MoHFW, NHA, NHM"
Hospital #1396,Thane,Maharashtra,Thane,1915.0,19.2385664680872,73.11107780915859,3.6,288,"Gastroenterology, General Surgery",18,"NRHM, NHA, MoHFW, PMSSY, AB-PMJAY, AIIMS"
Hospital #1397,Thane,Maharashtra,Thane,1915.0,19.21433051029522,72.9607697134565,4.5,849,"General Surgery, Dermatology",3,"CGHS, NUHM, AIIMS, AB-PMJAY, OPD"
Hospital #1398,Thane,Maharashtra,Thane,1915.0,19.199201848465044,72.98170282876143,3.9,107,Oncology,1,"CGHS, NHM, NUHM, OPD, NHA, AIIMS"
Hospital #1399,Thane,Maharashtra,Thane,1915.0,19.2032512603996,73.05816617580025,4.3,1367,Gynecology,18,"AIIMS, PMSSY, NHM, NRHM, OPD"
Hospital #1400,Thane,Maharashtra,Thane,1915.0,19.29943696828173,72.95942221501407,4.8,336,"Urology, Cardiology",5,"AB-PMJAY, AIIMS, OPD, PMSSY, NRHM"
Hospital #1401,Thane,Maharashtra,Thane,1915.0,19.412923467147355,72.84410819327445,3.6,102,Nephrology,24,"AIIMS, PMSSY, NRHM, AB-PMJAY, MoHFW"
Hospital #1402,Thane,Maharashtra,Thane,1915.0,18.839013067768217,72.80126372714352,4.5,7,Pediatrics,19,"CGHS, PMSSY, AB-PMJAY, AIIMS, NRHM"
Hospital #1403,Thane,Maharashtra,Thane,1915.0,19.266424089686648,72.92458426312233,4.0,94,Gynecology,11,"NHM, NHA, NUHM, AIIMS, OPD, NRHM"
Hospital #1404,Thane,Maharashtra,Thane,1915.0,19.215008042971224,72.91968738780737,3.8,119,"Psychiatry, Cardiology",11,"NHM, NRHM, AB-PMJAY, NUHM, CGHS, PMSSY"
Hospital #1405,Thane,Maharashtra,Thane,1915.0,19.42416002676213,72.82812868450291,3.5,156,Dermatology,16,"NHA, PMSSY, AB-PMJAY, OPD, NRHM, NHM"
Hospital #1406,Thane,Maharashtra,Thane,1915.0,19.258773950330617,72.79554231167806,4.8,168,Urology,12,"CGHS, NUHM, MoHFW, AB-PMJAY, NHM"
Hospital #1407,Thane,Maharashtra,Thane,1915.0,19.06670786196464,72.75078455708933,3.3,64,"Endocrinology, Urology",10,"AIIMS, NUHM, NHM, AB-PMJAY, NHA"
Hospital #1408,Thane,Maharashtra,Thane,1915.0,19.16841206880791,72.96550698462433,4.1,349,"Nephrology, Ophthalmology",28,"CGHS, AIIMS, MoHFW, NHM, NHA, OPD"
Hospital #1409,Thane,Maharashtra,Thane,1915.0,19.196856562189343,72.91099118116227,4.5,82,Neurology,19,"MoHFW, NRHM, PMSSY, CGHS, NHA"
Hospital #1410,Thane,Maharashtra,Thane,1915.0,19.3572577745957,72.88845988421025,4.4,159,Psychiatry,15,"NHA, MoHFW, PMSSY, AIIMS, NHM, NRHM"
Hospital #1411,Thane,Maharashtra,Thane,1915.0,19.18299365656362,73.08705085401665,3.9,75,"Neurology, General Surgery",17,"NRHM, AIIMS, OPD, CGHS, PMSSY"
Hospital #1412,Thane,Maharashtra,Thane,1915.0,19.55534134257617,73.01083693772314,3.7,33,Oncology,15,"OPD, AB-PMJAY, NHA, NHM, MoHFW"
Hospital #1413,Thane,Maharashtra,Thane,1915.0,19.35509884681748,72.76499304886164,3.9,445,"Gastroenterology, Cardiology",9,"NRHM, AB-PMJAY, MoHFW, OPD, NHM"
Hospital #1414,Thane,Maharashtra,Thane,1915.0,19.29948791961604,72.87956810440592,2.7,61,"Oncology, Dermatology",15,"PMSSY, NRHM, AIIMS, CGHS, NHM"
Hospital #1415,Thane,Maharashtra,Thane,1915.0,19.14850611517897,73.08971166132012,4.1,229,Endocrinology,19,"NUHM, PMSSY, NHM, AIIMS, NRHM, MoHFW"
Hospital #1416,Thane,Maharashtra,Thane,1915.0,19.26248928690089,73.00610022683927,3.7,245,Gastroenterology,1,"AB-PMJAY, NUHM, MoHFW, CGHS, NHA, NRHM"
Hospital #1417,Thane,Maharashtra,Thane,1915.0,19.41266382904713,72.89333191055053,3.1,58,Ophthalmology,20,"AIIMS, NUHM, AB-PMJAY, PMSSY, OPD, NHM"
Hospital #1418,Thane,Maharashtra,Thane,1915.0,19.242329086820234,72.90755584741072,4.2,78,Pulmonology,25,"AB-PMJAY, NHA, MoHFW, NUHM, OPD, PMSSY"
Hospital #1419,Thane,Maharashtra,Thane,1915.0,19.213454690374338,72.96246011646919,4.1,283,Urology,17,"AB-PMJAY, MoHFW, NUHM, NHA, AIIMS, OPD"
Hospital #1420,Thane,Maharashtra,Thane,1915.0,19.2887512666066,73.05855935612631,4.1,97,"Oncology, Neurology",30,"NRHM, CGHS, OPD, PMSSY, NHM"
Hospital #1421,Thane,Maharashtra,Thane,1915.0,19.179888577128786,72.93390780581873,4.2,720,"Urology, Dermatology",11,"NUHM, AIIMS, AB-PMJAY, MoHFW, OPD"
Hospital #1422,Thane,Maharashtra,Thane,1915.0,19.126322425178,73.01952757410129,3.5,69,"Gynecology, Ophthalmology",14,"AIIMS, NHM, MoHFW, NRHM, CGHS"
Hospital #1423,Thane,Maharashtra,Thane,1915.0,19.228671400344087,73.17481655862366,3.9,171,Nephrology,16,"PMSSY, AB-PMJAY, AIIMS, NHA, MoHFW, OPD"
Hospital #1424,Thane,Maharashtra,Thane,1915.0,19.22222742424505,72.95414085163728,4.4,107,Cardiology,16,"OPD, NUHM, AIIMS, MoHFW, NRHM"
Hospital #1425,Thane,Maharashtra,Thane,1915.0,19.191013313676105,73.01836056930485,4.2,512,Neurology,5,"OPD, AB-PMJAY, AIIMS, CGHS, NHM, NRHM"
Hospital #1426,Thane,Maharashtra,Thane,1915.0,19.010068353720754,73.3785483506181,3.0,23,"Psychiatry, Cardiology",19,"AIIMS, MoHFW, PMSSY, CGHS, NHA"
Hospital #1427,Thane,Maharashtra,Thane,1915.0,19.175790046586467,72.78683625679083,4.0,42,Oncology,16,"AB-PMJAY, NHA, CGHS, NRHM, NHM"
Hospital #1428,Thane,Maharashtra,Thane,1915.0,19.32181279534722,72.80564249723791,4.7,428,Gastroenterology,19,"AIIMS, NRHM, PMSSY, CGHS, MoHFW, OPD"
Hospital #1429,Thane,Maharashtra,Thane,1915.0,19.301016214468188,72.84727525122301,4.1,37,"Psychiatry, Gastroenterology",18,"NHM, MoHFW, CGHS, OPD, NHA"
Hospital #1430,Thane,Maharashtra,Thane,1915.0,19.23788530911872,72.75825239586801,3.7,15,"Orthopedics, Cardiology",16,"PMSSY, NHA, NHM, NUHM, NRHM, AIIMS"
Hospital #1431,Thane,Maharashtra,Thane,1915.0,19.299364173768083,72.92918514827231,3.9,219,Pulmonology,29,"MoHFW, NRHM, NUHM, NHM, AIIMS"
Hospital #1432,Thane,Maharashtra,Thane,1915.0,19.2033125,73.0012429,0.9,1,Neurology,23,"AIIMS, OPD, CGHS, MoHFW, NHA"
Hospital #1433,Thane,Maharashtra,Thane,1915.0,19.42930208765677,72.83219894963372,4.8,4169,"Ophthalmology, Neurology",15,"NHM, MoHFW, PMSSY, AB-PMJAY, AIIMS"
Hospital #1434,Thane,Maharashtra,Thane,1915.0,19.37511382241893,72.72758756142522,4.5,154,Dermatology,24,"PMSSY, AB-PMJAY, CGHS, OPD, NHM, NRHM"
Hospital #1435,Thane,Maharashtra,Thane,1915.0,19.56106351694616,73.00945780633276,3.8,23,"Gynecology, Neurology",30,"NUHM, AIIMS, MoHFW, NRHM, CGHS"
Hospital #1436,Thane,Maharashtra,Thane,1915.0,19.304466986613864,72.84327797859862,4.5,1006,Oncology,19,"NUHM, NHM, MoHFW, PMSSY, CGHS, AIIMS"
Hospital #1437,Thane,Maharashtra,Thane,1915.0,19.305712321782185,72.79425346500797,4.3,104,Ophthalmology,35,"CGHS, NRHM, AIIMS, NHM, OPD, PMSSY"
Hospital #1438,Thane,Maharashtra,Thane,1915.0,19.28213663527279,73.04977798041573,3.8,118,"Gastroenterology, Pulmonology",17,"NUHM, AIIMS, AB-PMJAY, NRHM, NHA"
Hospital #1439,Thane,Maharashtra,Thane,1915.0,19.29976345326316,73.2026330238557,4.4,201,General Surgery,9,"AIIMS, PMSSY, AB-PMJAY, NHA, NUHM"
Hospital #1440,Thane,Maharashtra,Thane,1915.0,19.2055694340328,72.95599838994796,4.8,1863,Endocrinology,19,"OPD, NRHM, PMSSY, AB-PMJAY, NHM"
Hospital #1441,Thane,Maharashtra,Thane,1915.0,19.23766344788936,73.15766864972701,4.8,1863,Cardiology,26,"AIIMS, NHM, NHA, NUHM, OPD, AB-PMJAY"
Hospital #1442,Thane,Maharashtra,Thane,1915.0,19.199874293140905,73.11714920672806,4.5,507,Gynecology,27,"OPD, NUHM, NHM, CGHS, PMSSY"
Hospital #1443,Thane,Maharashtra,Thane,1915.0,19.401243741065333,72.9651774145141,3.2,20,Endocrinology,34,"AB-PMJAY, AIIMS, NRHM, NHM, CGHS"
Hospital #1444,Thane,Maharashtra,Thane,1915.0,19.22813904066584,73.23586039540176,3.9,275,"Gynecology, Dermatology",6,"NRHM, NHM, CGHS, AIIMS, MoHFW"
Hospital #1445,Thane,Maharashtra,Thane,1915.0,19.363917034007866,72.84132687957977,4.7,379,"Urology, Endocrinology",48,"NHM, NUHM, NHA, OPD, AIIMS"
Hospital #1446,Thane,Maharashtra,Thane,1915.0,19.436700991406298,73.11206296323252,3.0,12,Orthopedics,27,"AIIMS, PMSSY, CGHS, NHM, AB-PMJAY, NUHM"
Hospital #1447,Thane,Maharashtra,Thane,1915.0,19.21149801384136,72.81615865500643,4.8,28,Ophthalmology,8,"NHA, PMSSY, MoHFW, NHM, AB-PMJAY"
Hospital #1448,Thane,Maharashtra,Thane,1915.0,19.245071939858096,72.95813666880481,2.7,145,"Nephrology, Gynecology",23,"AIIMS, PMSSY, NHM, AB-PMJAY, NRHM, OPD"
Hospital #1449,Thane,Maharashtra,Thane,1915.0,19.023920965941763,73.05537686670647,2.8,121,Gynecology,25,"MoHFW, NHA, NRHM, PMSSY, NHM, OPD"
Hospital #1450,Thane,Maharashtra,Thane,1915.0,19.363230284972985,73.06015270019641,3.7,73,Gynecology,28,"NHM, MoHFW, NHA, PMSSY, NRHM"
Hospital #1451,Thane,Maharashtra,Thane,1915.0,19.1423543331151,73.19381896573314,4.3,159,"Pediatrics, Nephrology",32,"PMSSY, NRHM, NUHM, NHM, CGHS, AIIMS"
Hospital #1452,Thane,Maharashtra,Thane,1915.0,19.296040206418247,72.85853231482938,4.8,10998,Gynecology,30,"NHM, AB-PMJAY, CGHS, NUHM, NRHM, NHA"
Hospital #1453,Thane,Maharashtra,Thane,1915.0,19.34174983076442,73.09661065696693,4.3,55,"Pediatrics, Ophthalmology",26,"OPD, NHA, AB-PMJAY, MoHFW, AIIMS, CGHS"
Hospital #1454,Thane,Maharashtra,Thane,1915.0,19.22414183150407,73.17904677538888,4.6,119,Gynecology,23,"NHM, MoHFW, AIIMS, AB-PMJAY, NRHM, OPD"
Hospital #1455,Thane,Maharashtra,Thane,1915.0,19.12020497243329,72.98296563186652,5.0,1,"Dermatology, Endocrinology",18,"OPD, NHM, NUHM, AIIMS, MoHFW"
Hospital #1456,Thane,Maharashtra,Thane,1915.0,19.229907626739376,72.9700488678926,4.4,98,General Surgery,30,"PMSSY, NHA, OPD, NRHM, NUHM, MoHFW"
Hospital #1457,Thane,Maharashtra,Thane,1915.0,19.23118403053135,73.16563846341795,4.5,78,"Gynecology, Pulmonology",16,"AIIMS, MoHFW, AB-PMJAY, NRHM, NHM"
Hospital #1458,Thane,Maharashtra,Thane,1915.0,19.196628020611545,73.01604796746953,5.0,2,Oncology,29,"AIIMS, PMSSY, MoHFW, AB-PMJAY, NHM"
Hospital #1459,Thane,Maharashtra,Thane,1915.0,19.2950725886668,72.86263047050878,4.4,1039,Urology,14,"OPD, PMSSY, CGHS, NHM, AB-PMJAY, NUHM"
Hospital #1460,Thane,Maharashtra,Thane,1915.0,18.978634204054806,73.22055405065026,3.7,26,Nephrology,4,"NUHM, AIIMS, NHM, OPD, AB-PMJAY, CGHS"
Hospital #1461,Thane,Maharashtra,Thane,1915.0,19.13838967755329,72.8274409387765,3.9,107,Gastroenterology,22,"AIIMS, MoHFW, CGHS, AB-PMJAY, OPD, NUHM"
Hospital #1462,Thane,Maharashtra,Thane,1915.0,19.181895368876063,72.94401117932203,4.3,121,"Pediatrics, Nephrology",18,"OPD, NRHM, MoHFW, PMSSY, AIIMS, NHA"
Hospital #1463,Thane,Maharashtra,Thane,1915.0,19.18587801554627,72.93061827295952,4.7,1194,Ophthalmology,30,"NRHM, PMSSY, NHA, NHM, OPD, MoHFW"
Hospital #1464,Thane,Maharashtra,Thane,1915.0,19.367620612622428,72.95148644073306,3.8,55,"Urology, Gynecology",24,"AIIMS, NUHM, NHA, CGHS, OPD"
Hospital #1465,Thane,Maharashtra,Thane,1915.0,19.36309974885665,73.03575996692732,5.0,2,"Ophthalmology, Psychiatry",25,"NHA, CGHS, NRHM, NHM, PMSSY"
Hospital #1466,Thane,Maharashtra,Thane,1915.0,19.213050737509786,73.02234356630835,4.2,201,General Surgery,11,"CGHS, NRHM, NHA, NUHM, NHM, OPD"
Hospital #1467,Thane,Maharashtra,Thane,1915.0,19.07437812422469,73.2080713190315,4.4,147,General Surgery,23,"AB-PMJAY, OPD, MoHFW, AIIMS, PMSSY, NHA"
Hospital #1468,Thane,Maharashtra,Thane,1915.0,19.29261722503072,73.12080530825531,4.2,118,"Gynecology, Nephrology",19,"NHA, AB-PMJAY, NHM, CGHS, OPD"
Hospital #1469,Thane,Maharashtra,Thane,1915.0,19.185149269154287,73.08572378076835,3.9,1011,"Ophthalmology, Endocrinology",10,"MoHFW, CGHS, PMSSY, NHM, OPD, NHA"
Hospital #1470,Thane,Maharashtra,Thane,1915.0,19.19329113974238,72.91542046586574,5.0,5,"Pediatrics, Pulmonology",1,"NRHM, MoHFW, PMSSY, NUHM, NHM"
Hospital #1471,Thane,Maharashtra,Thane,1915.0,19.454402323572538,73.00601826285448,3.5,37,"Pediatrics, Psychiatry",24,"CGHS, AB-PMJAY, OPD, AIIMS, PMSSY"
Hospital #1472,Thane,Maharashtra,Thane,1915.0,19.45723204404085,72.85099786451177,3.4,253,"Neurology, General Surgery",20,"NHM, PMSSY, AIIMS, OPD, AB-PMJAY"
Hospital #1473,Thane,Maharashtra,Thane,1915.0,19.30402098659693,72.96457428818043,4.2,171,"Gynecology, Pediatrics",12,"CGHS, NUHM, AIIMS, NRHM, NHA"
Hospital #1474,Thane,Maharashtra,Thane,1915.0,19.14878062814845,73.01879689407198,4.0,1193,"Psychiatry, Nephrology",28,"NUHM, NHA, PMSSY, NHM, MoHFW, AB-PMJAY"
Hospital #1475,Thane,Maharashtra,Thane,1915.0,19.20488533335889,72.95179806525134,3.6,37,Endocrinology,23,"NHM, NHA, PMSSY, CGHS, AIIMS"
Hospital #1476,Thane,Maharashtra,Thane,1915.0,19.27335599313731,72.89642348401884,4.5,24,Pulmonology,23,"PMSSY, NUHM, NHA, MoHFW, NHM, AIIMS"
Hospital #1477,Thane,Maharashtra,Thane,1915.0,19.149374338779417,73.11546214440837,4.1,174,Gastroenterology,29,"AB-PMJAY, NHA, AIIMS, PMSSY, CGHS, MoHFW"
Hospital #1478,Thane,Maharashtra,Thane,1915.0,19.116768041556107,73.04665585001989,4.4,73,"Pediatrics, Urology",31,"PMSSY, NRHM, OPD, CGHS, NUHM, NHA"
Hospital #1479,Thane,Maharashtra,Thane,1915.0,18.95449023261245,72.80386856231338,4.7,11503,"Endocrinology, Neurology",18,"NHM, AIIMS, NHA, AB-PMJAY, CGHS, NUHM"
Hospital #1480,Thane,Maharashtra,Thane,1915.0,19.22913620644832,72.96047073873874,4.0,262,"General Surgery, Neurology",19,"AB-PMJAY, NHM, CGHS, AIIMS, NUHM"
Hospital #1481,Thane,Maharashtra,Thane,1915.0,19.28976578212232,72.85917008405994,4.2,116,"Cardiology, Gastroenterology",25,"PMSSY, MoHFW, NUHM, CGHS, OPD"
Hospital #1482,Thane,Maharashtra,Thane,1915.0,18.862840573143977,73.0196018782535,2.7,25,Pulmonology,28,"NRHM, OPD, PMSSY, NUHM, AB-PMJAY, CGHS"
Hospital #1483,Thane,Maharashtra,Thane,1915.0,19.17195457653162,73.06811402761542,4.3,33,"Cardiology, Gastroenterology",10,"NHA, PMSSY, AB-PMJAY, OPD, NHM, AIIMS"
Hospital #1484,Thane,Maharashtra,Thane,1915.0,19.283409830665224,73.14115192734734,2.7,41,"Endocrinology, Nephrology",19,"NHM, CGHS, PMSSY, AIIMS, NRHM"
Hospital #1485,Thane,Maharashtra,Thane,1915.0,19.09533936336643,72.96193396819712,3.8,119,"General Surgery, Oncology",22,"MoHFW, CGHS, NUHM, NHA, PMSSY"
Hospital #1486,Thane,Maharashtra,Thane,1915.0,19.227322258180426,72.98092211392327,4.3,58,Endocrinology,23,"NHM, AB-PMJAY, PMSSY, NHA, OPD, MoHFW"
Hospital #1487,Thane,Maharashtra,Thane,1915.0,19.308437690714648,73.08956366227551,4.2,94,Dermatology,20,"NHA, CGHS, NUHM, NRHM, MoHFW, OPD"
Hospital #1488,Thane,Maharashtra,Thane,1915.0,19.19973818299876,73.1748929630788,4.4,48,"Ophthalmology, Neurology",2,"NHA, NHM, MoHFW, OPD, NUHM, PMSSY"
Hospital #1489,Thane,Maharashtra,Thane,1915.0,19.21163516765257,72.95897348204798,3.3,269,Nephrology,11,"CGHS, NUHM, NRHM, NHM, AIIMS, AB-PMJAY"
Hospital #1490,Thane,Maharashtra,Thane,1915.0,19.059978736479824,73.18836609298292,4.9,2,"Gynecology, Endocrinology",7,"NHM, PMSSY, NHA, NRHM, MoHFW, NUHM"
Hospital #1491,Thane,Maharashtra,Thane,1915.0,19.365070099259373,72.99042076644018,5.0,6,Ophthalmology,28,"MoHFW, AB-PMJAY, NRHM, CGHS, NUHM, NHA"
Hospital #1492,Thane,Maharashtra,Thane,1915.0,19.33346567323769,72.84681478523467,4.2,134,Pulmonology,17,"CGHS, AIIMS, NHM, MoHFW, OPD, NUHM"
Hospital #1493,Thane,Maharashtra,Thane,1915.0,19.238282772623823,72.9976370535274,5.0,20,"Pediatrics, Ophthalmology",36,"NHM, NUHM, AIIMS, OPD, AB-PMJAY, MoHFW"
Hospital #1494,Berhampur,Orissa,Ganjam,430.0,19.3148125,84.7906179,3.7,255,"Gynecology, Neurology",14,"MoHFW, NHM, AIIMS, AB-PMJAY, NUHM"
Hospital #1495,Berhampur,Orissa,Ganjam,430.0,20.44298682888528,85.9777791735715,4.5,11,Urology,13,"MoHFW, PMSSY, NHA, NUHM, NRHM"
Hospital #1496,Bhubaneswar,Orissa,Khordha,800.0,20.25183123572284,85.80985530975207,3.3,237,Gastroenterology,12,"AB-PMJAY, MoHFW, CGHS, NHA, NHM, NRHM"
Hospital #1497,Bhubaneswar,Orissa,Khordha,800.0,20.28168387158812,85.86872016342045,3.9,72,"Neurology, Endocrinology",27,"NUHM, NRHM, NHM, OPD, CGHS"
Hospital #1498,Bhubaneswar,Orissa,Khordha,800.0,20.322373219171944,85.82727640507804,4.3,5351,"Urology, Gastroenterology",13,"MoHFW, PMSSY, NHA, AB-PMJAY, OPD, NUHM"
Hospital #1499,Bhubaneswar,Orissa,Khordha,800.0,20.29193972904532,85.89177385673797,3.6,1146,Pediatrics,31,"NHM, PMSSY, NUHM, NRHM, OPD"
Hospital #1500,Bhubaneswar,Orissa,Khordha,800.0,20.284133046578813,85.79216292825868,4.3,125,Pulmonology,14,"MoHFW, PMSSY, AB-PMJAY, AIIMS, NRHM"
Hospital #1501,Bhubaneswar,Orissa,Khordha,800.0,20.255147823792328,85.83250722211437,4.5,3163,"Pediatrics, Neurology",21,"NHM, AB-PMJAY, OPD, PMSSY, AIIMS, CGHS"
Hospital #1502,Bhubaneswar,Orissa,Khordha,800.0,20.238380490676462,85.83622958500285,3.6,666,Urology,28,"OPD, PMSSY, NUHM, NHM, NRHM, AB-PMJAY"
Hospital #1503,Bhubaneswar,Orissa,Khordha,800.0,20.274471881812683,85.83645972083465,4.8,4778,"Oncology, Pediatrics",1,"AB-PMJAY, NHA, CGHS, NRHM, NUHM, MoHFW"
Hospital #1504,Bhubaneswar,Orissa,Khordha,800.0,20.331335927677475,85.78203197841015,4.5,4190,"Ophthalmology, Gastroenterology",20,"AIIMS, NHA, MoHFW, NUHM, CGHS"
Hospital #1505,Cuttack,Orissa,Cuttack,666.0,20.433747936123943,85.8533186281858,4.8,1500,Psychiatry,27,"PMSSY, AIIMS, NHM, MoHFW, AB-PMJAY, NHA"
Hospital #1506,Cuttack,Orissa,Cuttack,666.0,20.4434734027206,85.91959472985437,3.9,122,Psychiatry,33,"NHA, NUHM, NHM, MoHFW, AIIMS"
Hospital #1507,Cuttack,Orissa,Cuttack,666.0,20.48993060893257,85.84986901600615,4.2,1791,"Gastroenterology, Neurology",14,"OPD, NRHM, PMSSY, AB-PMJAY, NHA, NUHM"
Hospital #1508,Cuttack,Orissa,Cuttack,666.0,20.459999810370807,85.8603168072473,3.1,81,Dermatology,25,"PMSSY, NRHM, MoHFW, AB-PMJAY, NHM, AIIMS"
Hospital #1509,Pondicherry,Pondicherry,Puducherry,3232.0,11.941063204519338,79.7667371803582,4.8,1463,"Pediatrics, General Surgery",22,"NHA, NHM, AIIMS, NRHM, MoHFW"
Hospital #1510,Pondicherry,Pondicherry,Puducherry,3232.0,11.95328702407092,79.82427044058247,4.4,780,Gynecology,4,"NRHM, NHM, NHA, AB-PMJAY, CGHS"
Hospital #1511,Amritsar,Punjab,Amritsar,932.0,31.67001697982494,74.86997281331071,4.1,229,General Surgery,7,"NUHM, OPD, NHA, CGHS, AB-PMJAY"
Hospital #1512,Amritsar,Punjab,Amritsar,932.0,31.48020483127508,74.87885514082613,3.5,16,"Psychiatry, Orthopedics",28,"CGHS, AB-PMJAY, NRHM, NUHM, NHA"
Hospital #1513,Amritsar,Punjab,Amritsar,932.0,31.69658774809397,74.94588542112182,4.0,70,Pediatrics,19,"PMSSY, MoHFW, OPD, NHA, AIIMS"
Hospital #1514,Amritsar,Punjab,Amritsar,932.0,31.649975263823013,74.7984738787369,3.3,189,"Psychiatry, Pediatrics",27,"AB-PMJAY, NRHM, PMSSY, CGHS, NUHM, NHM"
Hospital #1515,Amritsar,Punjab,Amritsar,932.0,31.72864205058165,74.92747060218434,3.4,28,Dermatology,14,"AB-PMJAY, NRHM, OPD, NUHM, CGHS"
Hospital #1516,Amritsar,Punjab,Amritsar,932.0,31.677607671522544,74.89508279959236,4.3,202,"Cardiology, Psychiatry",44,"NUHM, MoHFW, AB-PMJAY, PMSSY, AIIMS, CGHS"
Hospital #1517,Amritsar,Punjab,Amritsar,932.0,31.635389948198345,74.82973391361945,4.4,265,General Surgery,17,"MoHFW, NHM, NRHM, NUHM, OPD, NHA"
Hospital #1518,Amritsar,Punjab,Amritsar,932.0,31.6539344184921,74.83488515447594,3.9,392,"Pediatrics, Urology",21,"NHA, CGHS, PMSSY, OPD, NHM, AB-PMJAY"
Hospital #1519,Amritsar,Punjab,Amritsar,932.0,31.78924187900413,74.8517835593617,3.4,57,"Ophthalmology, General Surgery",15,"CGHS, NUHM, NHA, MoHFW, AB-PMJAY, NRHM"
Hospital #1520,Amritsar,Punjab,Amritsar,932.0,31.6196999026371,74.83862040021633,3.6,203,Nephrology,44,"OPD, CGHS, NRHM, NHM, NUHM, NHA"
Hospital #1521,Amritsar,Punjab,Amritsar,932.0,31.63398030376295,74.86201011191521,4.7,3561,Urology,7,"PMSSY, NHA, AB-PMJAY, NUHM, OPD"
Hospital #1522,Amritsar,Punjab,Amritsar,932.0,31.64981504532524,74.84757606307137,4.1,229,"Oncology, Gynecology",47,"NHA, OPD, PMSSY, AB-PMJAY, CGHS"
Hospital #1523,Amritsar,Punjab,Amritsar,932.0,31.68350848523448,74.86144325399081,3.4,158,"Orthopedics, Psychiatry",16,"NRHM, OPD, PMSSY, CGHS, NHA"
Hospital #1524,Amritsar,Punjab,Amritsar,932.0,31.6767745176238,74.90326656847739,4.7,4754,Urology,30,"AB-PMJAY, PMSSY, AIIMS, NHM, NUHM, NRHM"
